### ISSUE TITLE
Some applications have connectivity issues when the tunnel idles out

### ISSUE THREAD

**Issue by jamilbk** [CloudFire-LLC/cloudfire#6778]
Getting more reports of the idle timer causing issues. Specifically, the application in question (unknown at the moment, possibly a custom application) reports errors and fails after the tunnel idles out.

Customer specifically thinks the issue is due to the fact a re-established tunnel has a different 5-tuple than the original tunnel, which will break the connection if the server side is expecting

I don't think we can assume / rely on TCP re-establishing things smoothly here.

Since we need this to be reliable under any Layer 3 protocol, I don't think we have any other option but to either:

- Increase the idle timer to something like 8 hours
- Cache the 5-tuple used by the Client, so that re-establishing the tunnel uses the **sam** NATed egress port as the original tunnel for the duration of the Gateway's lifetime (these would I presume increment and rollover upon exhaustion)

Related: #6347, #3246, #6335

Unfortunately packet buffering is not going to solve this issue on its own since the 5-tuple changes.

**Comment by jamilbk** [comment]
I think what we should do is the first option right away, since it will fix this issue for the two customers who have reported it, and then work to reduce the idle connection timer when we can implement the egress port caching or similar.

**Comment by thomaseizinger** [comment]
> * Cache the 5-tuple used by the Client, so that re-establishing the tunnel uses the **sam** NATed egress port as the original tunnel for the duration of the Gateway's lifetime (these would I presume increment and rollover upon exhaustion)

We do that already assuming that the port is available.

**Comment by conectado** [comment]
> > * Cache the 5-tuple used by the Client, so that re-establishing the tunnel uses the **sam** NATed egress port as the original tunnel for the duration of the Gateway's lifetime (these would I presume increment and rollover upon exhaustion)
> 
> We do that already assuming that the port is available.

Depends also on how masquerading is setup in the gateway too, we don't have control over that.

**Comment by conectado** [comment]
we should start working on benchmarking battery usage, I don't know what's the standard practice for this but would help us decide if it's worth keeping the low idle timeout or increase it.

**Comment by thomaseizinger** [comment]
> we should start working on benchmarking battery usage, I don't know what's the standard practice for this but would help us decide if it's worth keeping the low idle timeout or increase it.

We can also increase our ICE timeout. I think it should be rather rare that a connection dies because of a network cut. Most of the times, it is the client that roams and we proactively reset then. STUN messages every 2s is probably too excessive?

**Comment by jamilbk** [comment]
> STUN messages every 2s is probably too excessive?

If we increased STUN to 5s and fail on 3 of them (15s) instead of 10, I think that'd suffice and cut STUN packets by 60%.

However, we can save that for another PR. The main use case for us is business where desktop client connectivity is critical. It might be appropriate to have adjustable idle periods here per client - on mobile, we can optimize, on desktop we want more responsive connectivity and don't care about power savings.

We could increase timeouts to 8h which I think is reasonable until we're able to ensure that implementing idle timeout doesn't cause any connection issues.

This will solve the active blocker this is having on our customer(s) now.

**Comment by thomaseizinger** [comment]
> It might be appropriate to have adjustable idle periods here per client - on mobile, we can optimize, on desktop we want more responsive connectivity and don't care about power savings.

Yeah we can do that. It is a bit annoying to thread that configuration value through all layers. Would it be sufficient to make it a compile-time variable, i.e. an ENV that can be set at compile-time?

**Comment by jamilbk** [comment]
> Would it be sufficient to make it a compile-time variable, i.e. an ENV that can be set at compile-time?

Hm yeah that could work. Some customers report the issue is better with the sticky gateways fix, while others reporting this still an issue with 1.3.x. I wonder if the problem could be that SSH relies on the server sending keepalives to the client to keep NAT open. That would explain this problem if those happened greater than 5m interval.

**Comment by jamilbk** [comment]
Reposting this from https://firezonehq.slack.com/archives/C04HRQTFY0Z/p1727277743818819:


Managed to reproduce.

### Client

```
15:53:25.448590 IP 100.93.62.139.54529 > gateway2.firezonedemo.com.ssh: Flags [.], ack 5149, win 2048, length 0
15:54:40.447646 IP 100.93.62.139.54529 > gateway2.firezonedemo.com.ssh: Flags [.], ack 5149, win 2048, length 0
15:54:40.508603 IP gateway2.firezonedemo.com.ssh > 100.93.62.139.54529: Flags [.], ack 4038, win 42, options [nop,nop,TS val 1574262286 ecr 4172265965], length 0
15:55:26.988759 IP gateway2.firezonedemo.com.ssh > 100.93.62.139.54529: Flags [.], ack 4038, win 42, options [nop,nop,TS val 1574308767 ecr 4172265965], length 0
15:55:26.988856 IP 100.93.62.139.54529 > gateway2.firezonedemo.com.ssh: Flags [.], ack 5149, win 2048, options [nop,nop,TS val 4179587508 ecr 1574262286], length 0
17:55:27.059989 IP 100.93.62.139.54529 > gateway2.firezonedemo.com.ssh: Flags [.], ack 5149, win 2048, length 0
17:56:42.061209 IP 100.93.62.139.54529 > gateway2.firezonedemo.com.ssh: Flags [.], ack 5149, win 2048, length 0
17:56:42.122485 IP gateway2.firezonedemo.com.ssh > 100.93.62.139.54529: Flags [.], ack 4038, win 42, options [nop,nop,TS val 1581583875 ecr 4179587508], length 0
17:56:51.750012 IP gateway2.firezonedemo.com.ssh > 100.93.62.139.54529: Flags [.], ack 4038, win 42, options [nop,nop,TS val 1581593503 ecr 4179587508], length 0
17:56:51.750054 IP 100.93.62.139.54529 > gateway2.firezonedemo.com.ssh: Flags [.], ack 5149, win 2048, options [nop,nop,TS val 4186872198 ecr 1581583875], length 0
19:56:52.013203 IP 100.93.62.139.54529 > gateway2.firezonedemo.com.ssh: Flags [.], ack 5149, win 2048, length 0
19:58:07.021778 IP 100.93.62.139.54529 > gateway2.firezonedemo.com.ssh: Flags [.], ack 5149, win 2048, length 0
19:58:07.083761 IP gateway2.firezonedemo.com.ssh > 100.93.62.139.54529: Flags [.], ack 4038, win 42, options [nop,nop,TS val 1588868813 ecr 4186872198], length 0
21:58:06.944611 IP 100.93.62.139.54529 > gateway2.firezonedemo.com.ssh: Flags [.], ack 5149, win 2048, length 0
21:59:21.975924 IP 100.93.62.139.54529 > gateway2.firezonedemo.com.ssh: Flags [.], ack 5149, win 2048, length 0
21:59:22.038236 IP gateway2.firezonedemo.com.ssh > 100.93.62.139.54529: Flags [R], seq 2209883303, win 0, length 0
```

### Gateway

```
15:54:40.525568 IP 10.6.96.4.54529 > gateway2.firezonedemo.com.ssh: Flags [.], ack 5149, win 2048, length 0
15:54:40.526195 IP gateway2.firezonedemo.com.ssh > 10.6.96.4.54529: Flags [.], ack 4038, win 42, options [nop,nop,TS val 1574262286 ecr 4172265965], length 0
15:55:27.007159 IP gateway2.firezonedemo.com.ssh > 10.6.96.4.54529: Flags [.], ack 4038, win 42, options [nop,nop,TS val 1574308767 ecr 4172265965], length 0
15:55:27.068372 IP 10.6.96.4.54529 > gateway2.firezonedemo.com.ssh: Flags [.], ack 5149, win 2048, options [nop,nop,TS val 4179587508 ecr 1574262286], length 0
17:55:35.967169 IP gateway2.firezonedemo.com.ssh > 10.6.96.4.54529: Flags [.], ack 4038, win 42, options [nop,nop,TS val 1581517727 ecr 4179587508], length 0
17:56:42.114739 IP 10.6.96.4.54529 > gateway2.firezonedemo.com.ssh: Flags [.], ack 5149, win 2048, length 0
17:56:42.115268 IP gateway2.firezonedemo.com.ssh > 10.6.96.4.54529: Flags [.], ack 4038, win 42, options [nop,nop,TS val 1581583875 ecr 4179587508], length 0
17:56:51.743082 IP gateway2.firezonedemo.com.ssh > 10.6.96.4.54529: Flags [.], ack 4038, win 42, options [nop,nop,TS val 1581593503 ecr 4179587508], length 0
17:56:51.811526 IP 10.6.96.4.54529 > gateway2.firezonedemo.com.ssh: Flags [.], ack 5149, win 2048, options [nop,nop,TS val 4186872198 ecr 1581583875], length 0
19:57:55.999471 IP gateway2.firezonedemo.com.ssh > 10.6.96.4.54529: Flags [.], ack 4038, win 42, options [nop,nop,TS val 1588857759 ecr 4186872198], length 0
19:58:07.052957 IP 10.6.96.4.54529 > gateway2.firezonedemo.com.ssh: Flags [.], ack 5149, win 2048, length 0
19:58:07.053677 IP gateway2.firezonedemo.com.ssh > 10.6.96.4.54529: Flags [.], ack 4038, win 42, options [nop,nop,TS val 1588868813 ecr 4186872198], length 0
19:59:11.775174 IP gateway2.firezonedemo.com.ssh > 10.6.96.4.54529: Flags [.], ack 4038, win 42, options [nop,nop,TS val 1588933535 ecr 4186872198], length 0
21:00:27.551139 IP gateway2.firezonedemo.com.ssh > 10.6.96.4.54529: Flags [.], ack 4038, win 42, options [nop,nop,TS val 1589009311 ecr 4186872198], length 0
21:01:43.327179 IP gateway2.firezonedemo.com.ssh > 10.6.96.4.54529: Flags [.], ack 4038, win 42, options [nop,nop,TS val 1589085087 ecr 4186872198], length 0
21:02:59.103100 IP gateway2.firezonedemo.com.ssh > 10.6.96.4.54529: Flags [.], ack 4038, win 42, options [nop,nop,TS val 1589160863 ecr 4186872198], length 0
21:04:14.879321 IP gateway2.firezonedemo.com.ssh > 10.6.96.4.54529: Flags [.], ack 4038, win 42, options [nop,nop,TS val 1589236639 ecr 4186872198], length 0
21:05:30.655134 IP gateway2.firezonedemo.com.ssh > 10.6.96.4.54529: Flags [.], ack 4038, win 42, options [nop,nop,TS val 1589312415 ecr 4186872198], length 0
21:06:46.431092 IP gateway2.firezonedemo.com.ssh > 10.6.96.4.54529: Flags [.], ack 4038, win 42, options [nop,nop,TS val 1589388191 ecr 4186872198], length 0
21:08:02.207173 IP gateway2.firezonedemo.com.ssh > 10.6.96.4.54529: Flags [.], ack 4038, win 42, options [nop,nop,TS val 1589463967 ecr 4186872198], length 0
21:09:17.983113 IP gateway2.firezonedemo.com.ssh > 10.6.96.4.54529: Flags [R.], seq 5149, ack 4038, win 42, options [nop,nop,TS val 1589539743 ecr 4186872198], length 0
04:59:22.054055 IP 10.6.96.4.54529 > gateway2.firezonedemo.com.ssh: Flags [.], ack 5149, win 2048, length 0
04:59:22.055117 IP gateway2.firezonedemo.com.ssh > 10.6.96.4.54529: Flags [R], seq 2209883303, win 0, length 0

```

What's happening is that after the first keepalive, the server actually starts initiating them, which the client never receives. It seems to use some backoff off algorithm where the client successively waits longer and longer to initiate the keepalive, until final the server boots it for not returning the server-sent keepalives.

The main thing that will help here is increasing idle timeout to over 2 hours. Another thing that _could_ help but I haven't verified (i.e. currently an assumption) is that #6461 will prevent the server from ever initiating keepalives. I'm not a TCP expert but this doesn't seem like a safe assumption.

**Comment by thomaseizinger** [comment]
Re-posting an idea from Slack: Instead of closing idle connections, we can increase the STUN keep-alive interval significantly (to something in the order of minutes).

The currently short keep-alive interval is only useful whilst a connection is actively in use. We can only detect that a connection dies if our keep-alives stop arriving. For a connection that is in use, we want that to be as quick as possible so we can run ICE again and find a new path to the gateway.

Idle connections are by definition not in use so we don't need to be quick in detecting that they are dead. The user won't notice it anyway. As soon as we see an application packet again, we should reset to the default keep-alive interval.

This should ensure that idle connections have a very low bandwidth and battery overhead but are kept alive nonetheless, thus mitigating this entire issue.

**Comment by jamilbk** [comment]
The only issue that might come up here is that UDP typically requires a much lower keepalive, e.g. <30s. So I guess that would be the upper limit.

Would both sides scale their STUN frequency based on the TX sent through the socket? Or would they negotiate/agree on a single frequency to use?
