### ISSUE TITLE
ACKs take onerously long to send on Apple platforms

### ISSUE THREAD

**Issue by jamilbk** [CloudFire-LLC/cloudfire#8899]
High suspicion that https://github.com/firezone/firezone/pull/7590 is causing a processing delay on Apple platforms where we aren't sending ACKs to related segments for sometimes up to 600ms.

Here's a minimal capture highlighting the issue.

[single_http.pcap.zip](https://github.com/user-attachments/files/19876190/single_http.pcap.zip)

**Comment by thomaseizinger** [comment]
> High suspicion that [#7590](https://github.com/firezone/firezone/pull/7590) is causing a processing delay on Apple platforms where we aren't sending ACKs to related segments for sometimes up to 600ms.

I am having a hard time reasoning that this PR is the root cause of the issue. It may be amplifying an existing one but I doubt it is the actual cause. I am very certain that with that PR we are doing the right thing of suspending writing to the UDP sockets when it can't keep up. Before, we were just dropping those packets.

I think we need to look elsewhere for the actual issue here. The biggest supporting argument for this is that this code is cross-platform and we are only witnessing this issue on MacOS.

**Comment by jamilbk** [comment]
~~The problem exists on Windows too, just not as pronounced. We also see retransmissions on Linux fairly often. TCP likes consistent delays, so maybe there's just too much variability in our processing stack.~~

EDIT: Taking a closer look, the `ACK`s on Windows are very low, similar to Linux. It looks like the problem on Windows is packet reordering. Opening a separate issue.

**Comment by jamilbk** [comment]
After sleeping on it for a couple days, the only three possibilities I can think of here are:

- The WireShark capture driver on `darwin` is not measuring at the points we think it is. I.e. the time we think spent in the kernel is not actually being spent in the kernel.
- The kernel is intentionally delaying sending the ACK because it is receiving too many out-of-order packets from the Gateway. I need to study TCP more to know if this is a plausible cause. This also fails to explain why changing just the macOS client version alleviates the issue.
- For some reason, something we've changed in our threading model (on the tokio runtime) in userland is affecting kernel-land contention.

**Comment by thomaseizinger** [comment]
> * The kernel is intentionally delaying sending the ACK because it is receiving too many out-of-order packets from the Gateway. I need to study TCP more to know if this is a plausible cause. This also fails to explain why changing just the macOS client version alleviates the issue.

Can you disable Nagle's algorithm system-wide (i.e. TCP nodelay)?

**Comment by jamilbk** [comment]
I just tested with `sysctl -w net.inet.tcp.delayed_ack = 0`, no perceptible difference:

[tcp_nodelay_macos.pcap.zip](https://github.com/user-attachments/files/19916955/tcp_nodelay_macos.pcap.zip)

**Comment by jamilbk** [comment]
Just as a data point because it was easy to test, setting `MAX_INBOUND_PACKET_BATCH` to `1` does not affect the issue, in case there was any suspicion that may be in play here.

**Comment by jamilbk** [comment]
dtrace or one of the tools listed here would probably be helpful in gathering more information here: https://poweruser.blog/using-dtrace-with-sip-enabled-3826a352e64b

**Comment by jamilbk** [comment]
dtrace or one of the tools listed here would probably be helpful in gathering more information here: https://poweruser.blog/using-dtrace-with-sip-enabled-3826a352e64b

**Comment by thomaseizinger** [comment]
I did some more analysis on this and manged to capture some packet traces on either end of the tunnel. One thing that I've found which is quite confusing is that sometimes, the packets coming from metabase are not filled to the max MTU despite being extremely close together:

```
9:03:49.585143 IP 10.128.15.241.3000 > 100.69.109.138.53474: Flags [.], seq 1:1229, ack 524, win 249, options [nop,nop,TS val 3862031964 ecr 1928356896], length 1228
09:03:49.585151 IP 10.128.15.241.3000 > 100.69.109.138.53474: Flags [P.], seq 1229:2063, ack 524, win 249, options [nop,nop,TS val 3862031964 ecr 1928356896], length 834
09:03:49.585157 IP 10.128.15.241.3000 > 100.69.109.138.53474: Flags [P.], seq 2063:3094, ack 524, win 249, options [nop,nop,TS val 3862031964 ecr 1928356896], length 1031
09:03:49.585187 IP 10.128.15.241.3000 > 100.69.109.138.53474: Flags [.], seq 3094:4322, ack 524, win 249, options [nop,nop,TS val 3862031964 ecr 1928356896], length 1228
09:03:49.585188 IP 10.128.15.241.3000 > 100.69.109.138.53474: Flags [P.], seq 4322:5156, ack 524, win 249, options [nop,nop,TS val 3862031964 ecr 1928356896], length 834
09:03:49.585227 IP 10.128.15.241.3000 > 100.69.109.138.53474: Flags [.], seq 5156:6384, ack 524, win 249, options [nop,nop,TS val 3862031964 ecr 1928356896], length 1228
09:03:49.585228 IP 10.128.15.241.3000 > 100.69.109.138.53474: Flags [P.], seq 6384:7612, ack 524, win 249, options [nop,nop,TS val 3862031964 ecr 1928356896], length 1228
09:03:49.585230 IP 10.128.15.241.3000 > 100.69.109.138.53474: Flags [P.], seq 7612:8249, ack 524, win 249, options [nop,nop,TS val 3862031964 ecr 1928356896], length 637
09:03:49.585846 IP 10.128.15.241.3000 > 100.69.109.138.53474: Flags [.], seq 8249:9477, ack 524, win 249, options [nop,nop,TS val 3862031964 ecr 1928356896], length 1228
09:03:49.585851 IP 10.128.15.241.3000 > 100.69.109.138.53474: Flags [P.], seq 9477:10705, ack 524, win 249, options [nop,nop,TS val 3862031964 ecr 1928356896], length 1228
```

In this particular instance of the packet capture, metabase actually loaded quite fast so I am not sure how much of a problem it is. WireShark will highlight all of these though as "TCP previous segment not captured" because our GSO component batches the payloads of size 1228 together which in the above are scattered across multiple batches.

This isn't at all how we expect IP to be used but I guess it is something we need to deal with.

**Comment by thomaseizinger** [comment]
Fixed in #8920.

**Comment by thomaseizinger** [comment]
This is still the case, despite us not reordering packets anymore.

Here is Linux:

![Image](https://github.com/user-attachments/assets/0906fda4-6c5f-4c27-85b5-cc43f2c2bcda)

We can see that it immediately sends an ACK for every received TCP packet.

Here is MacOS:

<img width="1426" alt="Image" src="https://github.com/user-attachments/assets/70b9eedf-c3f1-4813-9ad5-da4405f59707" />

It doesn't send any ACKs and after ~1s, the RTO is hit on the remote TCP stack and it starts retransmitting the first packet after which the TCP stack immediately send the ACK for it.

**Comment by thomaseizinger** [comment]
I just tested with a regular website, without our interface and weirdly enough, MacOS doesn't behave the same there. So there must be something we are doing wrong.

**Comment by jamilbk** [comment]
Buffer size?

**Comment by jamilbk** [comment]
I wonder if the 1.4.8 client shows similar behavior (latest release where Metabase worked smoothly)

**Comment by thomaseizinger** [comment]
It is a bit on and off. I can't even reproduce it now reliably on my Mac. Loading metabase works just fine now 🤷‍♂

**Comment by jamilbk** [comment]
Clear browser cache? I wonder if the http_bin server download is slow as well.

**Comment by thomaseizinger** [comment]
Okay, not sure if I am onto something but performing a packet capture on the Gateway's TUN device shows me all HTTP GET requests from MacOS to have incorrect TCP checksums.

**Comment by thomaseizinger** [comment]
Oh, I think it is ECN!

**Comment by thomaseizinger** [comment]
MacOS actually sets ECN bits on the outgoing packets, yet for some reason those appear to not be mirrored on the UDP packets so when we read them on the Gateway, the resulting IP packets are set to non-ECN. And I forgot to update the checksum there :(

**Comment by thomaseizinger** [comment]
This is now actually fixed with #9005.
