### ISSUE TITLE
`Unknown resource dst=100.100.111.1` in trace logs

### ISSUE THREAD

**Issue by jamilbk** [CloudFire-LLC/cloudfire#6749]
I noticed `**.google.com` isn't working for me as a Resource. `firezone-prod` Gateways (GCP). Upon attempting to debug, the Gateway logs look fine:

```
Sep 18 04:32:06 gateway-7zhj sudo[1701]: 2024-09-18T04:32:06.591055Z  INFO firezone_tunnel::gateway: Allowing access to resource client=91b9f3e6-7b9c-465f-aca8-9f4d7e8c4e3b resource=95ab56ae-619f-4a12-8b3b-48b6004f559c expires=Some("2024-09-25T04:32:01+00:00")
Sep 18 04:32:06 gateway-7zhj sudo[1701]: 2024-09-18T04:32:06.742648Z  INFO firezone_tunnel::gateway: Allowing access to resource client=91b9f3e6-7b9c-465f-aca8-9f4d7e8c4e3b resource=95ab56ae-619f-4a12-8b3b-48b6004f559c expires=Some("2024-09-25T04:32:01+00:00")
Sep 18 04:32:06 gateway-7zhj sudo[1701]: 2024-09-18T04:32:06.806975Z  INFO handle_timeout{cid=91b9f3e6-7b9c-465f-aca8-9f4d7e8c4e3b}: snownet::node: Updating remote socket old=None new=Relay { relay: 9df94599-2e5a-4f7a-b06c-dbc7cf44ad41, dest: 107.197.104.68:58889 } duration_since_intent=0ns
Sep 18 04:32:06 gateway-7zhj sudo[1701]: 2024-09-18T04:32:06.845409Z  INFO handle_timeout{cid=91b9f3e6-7b9c-465f-aca8-9f4d7e8c4e3b}: snownet::node: Updating remote socket old=Some(Relay { relay: 9df94599-2e5a-4f7a-b06c-dbc7cf44ad41, dest: 107.197.104.68:58889 }) new=Direct { source: [2600:1900:4020:4c:0:74::]:60672, dest: [2600:1700:3ecb:2410:3d11:5d4e:79e8:73c2]:52694 } duration_since_intent=250ms
Sep 18 04:32:06 gateway-7zhj sudo[1701]: 2024-09-18T04:32:06.898685Z  INFO snownet::node: Completed wireguard handshake cid=91b9f3e6-7b9c-465f-aca8-9f4d7e8c4e3b duration_since_intent=307.752357ms
Sep 18 04:32:07 gateway-7zhj sudo[1701]: 2024-09-18T04:32:07.570671Z  INFO snownet::allocation: Updated allocation srflx_ip4=Some(35.237.252.155:54596) srflx_ip6=Some([2600:1900:4020:4c:0:74::]:60672) relay_ip4=Some(34.48.110.184:55720) relay_ip6=Some([2600:1900:4091:51f:0:1a::]:55720) remaining_lifetime=Some(600s)
Sep 18 04:32:08 gateway-7zhj sudo[1701]: 2024-09-18T04:32:08.513796Z  INFO snownet::allocation: Updated allocation srflx_ip4=Some(35.237.252.155:54596) srflx_ip6=Some([2600:1900:4020:4c:0:74::]:60672) relay_ip4=Some(34.23.106.0:49748) relay_ip6=Some([2600:1900:4020:8f68:0:6b::]:49748) remaining_lifetime=Some(600s)
Sep 18 04:32:27 gateway-7zhj sudo[1701]: 2024-09-18T04:32:27.476172Z  INFO firezone_tunnel::gateway: Allowing access to resource client=91b9f3e6-7b9c-465f-aca8-9f4d7e8c4e3b resource=95ab56ae-619f-4a12-8b3b-48b6004f559c expires=Some("2024-09-25T04:32:01+00:00")
Sep 18 04:32:33 gateway-7zhj sudo[1701]: 2024-09-18T04:32:33.283071Z  INFO firezone_tunnel::gateway: Allowing access to resource client=91b9f3e6-7b9c-465f-aca8-9f4d7e8c4e3b resource=95ab56ae-619f-4a12-8b3b-48b6004f559c expires=Some("2024-09-25T04:32:01+00:00")
Sep 18 04:32:49 gateway-7zhj sudo[1701]: 2024-09-18T04:32:49.303652Z  INFO firezone_tunnel::gateway: Allowing access to resource client=91b9f3e6-7b9c-465f-aca8-9f4d7e8c4e3b resource=95ab56ae-619f-4a12-8b3b-48b6004f559c expires=Some("2024-09-25T04:32:01+00:00")
Sep 18 04:32:50 gateway-7zhj sudo[1701]: 2024-09-18T04:32:50.947879Z  INFO firezone_tunnel::gateway: Allowing access to resource client=91b9f3e6-7b9c-465f-aca8-9f4d7e8c4e3b resource=95ab56ae-619f-4a12-8b3b-48b6004f559c expires=Some("2024-09-25T04:32:01+00:00")
```

And the Client debug logs look fine, but I noticed **lots** of these messages when using `firezone_tunnel=trace,debug`:

```
connlib	21:34:35.675359-0700	firezone_tunnel::client: Unknown resource dst=100.100.111.1
connlib	21:34:35.675412-0700	firezone_tunnel::dns: Parsed packet as DNS query: 'PTR 225.1.168.192.in-addr.arpa'
connlib	21:34:35.675457-0700	match_resource_linear{domain=225.1.168.192.in-addr.arpa}: firezone_tunnel::dns: No match pattern=**.ifconfig.co id=431da4dd-f88b-4a7f-9f4c-3673f98dfe2e
connlib	21:34:35.675616-0700	match_resource_linear{domain=225.1.168.192.in-addr.arpa}: firezone_tunnel::dns: No match pattern=**.google.com id=95ab56ae-619f-4a12-8b3b-48b6004f559c
connlib	21:34:35.675663-0700	match_resource_linear{domain=225.1.168.192.in-addr.arpa}: firezone_tunnel::dns: No match pattern=metabase.c.firezone-prod.internal id=9d0a0e7a-6a86-4498-a8e3-c19ff9677fdb
connlib	21:34:35.675774-0700	match_resource_linear{domain=225.1.168.192.in-addr.arpa}: firezone_tunnel::dns: No match pattern=showmyip.com id=47f613b6-6a52-4e17-a88c-5aa06d1438a9
connlib	21:34:35.675894-0700	match_resource_linear{domain=225.1.168.192.in-addr.arpa}: firezone_tunnel::dns: No match pattern=ifconfig.net id=0a00a5eb-a03e-4010-82ad-c7d4c2738517
connlib	21:34:35.675931-0700	match_resource_linear{domain=225.1.168.192.in-addr.arpa}: firezone_tunnel::dns: No match pattern=dnsleaktest.com id=a7510aba-e731-4f0a-aaec-102b705712fd
connlib	21:34:35.675966-0700	match_resource_linear{domain=225.1.168.192.in-addr.arpa}: firezone_tunnel::dns: No match pattern=speed.cloudflare.com id=fec99d5a-8537-4d04-829d-55ab1fcf875c
connlib	21:34:35.676074-0700	match_resource_linear{domain=225.1.168.192.in-addr.arpa}: firezone_tunnel::dns: No resources matched
connlib	21:34:35.676145-0700	firezone_tunnel::client: Unknown resource dst=100.100.111.1
connlib	21:34:39.857629-0700	firezone_tunnel::dns: Parsed packet as DNS query: 'PTR b._dns-sd._udp.0.1.168.192.in-addr.arpa'
connlib	21:34:39.857781-0700	match_resource_linear{domain=b._dns-sd._udp.0.1.168.192.in-addr.arpa}: firezone_tunnel::dns: No match pattern=**.ifconfig.co id=431da4dd-f88b-4a7f-9f4c-3673f98dfe2e
connlib	21:34:39.857846-0700	match_resource_linear{domain=b._dns-sd._udp.0.1.168.192.in-addr.arpa}: firezone_tunnel::dns: No match pattern=**.google.com id=95ab56ae-619f-4a12-8b3b-48b6004f559c
connlib	21:34:39.857892-0700	match_resource_linear{domain=b._dns-sd._udp.0.1.168.192.in-addr.arpa}: firezone_tunnel::dns: No match pattern=metabase.c.firezone-prod.internal id=9d0a0e7a-6a86-4498-a8e3-c19ff9677fdb
connlib	21:34:39.857939-0700	match_resource_linear{domain=b._dns-sd._udp.0.1.168.192.in-addr.arpa}: firezone_tunnel::dns: No match pattern=showmyip.com id=47f613b6-6a52-4e17-a88c-5aa06d1438a9
connlib	21:34:39.858164-0700	match_resource_linear{domain=b._dns-sd._udp.0.1.168.192.in-addr.arpa}: firezone_tunnel::dns: No match pattern=ifconfig.net id=0a00a5eb-a03e-4010-82ad-c7d4c2738517
connlib	21:34:39.858211-0700	match_resource_linear{domain=b._dns-sd._udp.0.1.168.192.in-addr.arpa}: firezone_tunnel::dns: No match pattern=dnsleaktest.com id=a7510aba-e731-4f0a-aaec-102b705712fd
connlib	21:34:39.858674-0700	match_resource_linear{domain=b._dns-sd._udp.0.1.168.192.in-addr.arpa}: firezone_tunnel::dns: No match pattern=speed.cloudflare.com id=fec99d5a-8537-4d04-829d-55ab1fcf875c
connlib	21:34:39.858721-0700	match_resource_linear{domain=b._dns-sd._udp.0.1.168.192.in-addr.arpa}: firezone_tunnel::dns: No resources matched
connlib	21:34:39.858841-0700	firezone_tunnel::client: Unknown resource dst=100.100.111.1
```

This results in all `google.com` domains failing to load (in browsers only!):

<img width="1792" alt="Screenshot 2024-09-17 at 9 35 26 PM" src="https://github.com/user-attachments/assets/27c17805-16e5-495b-b48f-1d6519475ad7">

**Comment by jamilbk** [comment]
`curl google.com` works fine. Here's a packet capture of the issue -- looks like we're getting TCP v6 RSTs:

```
257	17.729055	fd00:2021:1111::4660	fd00:2021:1111:8000::6	TCP	1280	[TCP Retransmission] 53481 → 443 [ACK] Seq=1 Ack=1 Win=2057 Len=1208 TSval=2954435414 TSecr=735669639
258	18.237815	fd00:2021:1111::4660	fd00:2021:1111:8000::6	TCP	1280	[TCP Retransmission] 53483 → 443 [ACK] Seq=1 Ack=1 Win=2057 Len=1208 TSval=1107184508 TSecr=3212164875
259	18.317019	fd00:2021:1111::4660	fd00:2021:1111:8000::6	TCP	1260	[TCP Retransmission] 53595 → 443 [ACK] Seq=1 Ack=1 Win=131648 Len=1188 TSval=1323802722 TSecr=1911843250
260	18.357742	fd00:2021:1111::4660	fd00:2021:1111:8000::e	TCP	1280	[TCP Retransmission] 53568 → 443 [ACK] Seq=1 Ack=1 Win=2057 Len=1208 TSval=2637526692 TSecr=2229340519
261	18.434483	fd00:2021:1111::4660	fd00:2021:1111:8000::2e	TCP	1280	[TCP Retransmission] 53550 → 443 [ACK] Seq=1 Ack=1 Win=2057 Len=1208 TSval=3254354851 TSecr=684269326
262	18.577555	fd00:2021:1111::4660	fd00:2021:1111:8000::6	TCP	1280	[TCP Retransmission] 53470 → 443 [ACK] Seq=1 Ack=1 Win=2057 Len=1208 TSval=3736305145 TSecr=1871558951
263	18.730641	fd00:2021:1111::4660	fd00:2021:1111:8000::26	TCP	1280	[TCP Retransmission] 53552 → 443 [ACK] Seq=1 Ack=1 Win=2057 Len=1208 TSval=4161009523 TSecr=1254393958
264	18.853488	fd00:2021:1111::4660	fd00:2021:1111:8000::a	TCP	1280	[TCP Retransmission] 53473 → 443 [ACK] Seq=1 Ack=1 Win=2057 Len=1208 TSval=1148524470 TSecr=230394803
275	19.214636	fd00:2021:1111::4660	fd00:2021:1111:8000::a	TCP	1280	[TCP Retransmission] 53554 → 443 [ACK] Seq=1 Ack=1 Win=2057 Len=1208 TSval=1518499412 TSecr=3144199661
276	19.303428	fd00:2021:1111::4660	fd00:2021:1111:8000::6	TCP	1280	[TCP Retransmission] 53469 → 443 [ACK] Seq=1 Ack=1 Win=2057 Len=1208 TSval=1640718911 TSecr=3397670454
```

**Comment by jamilbk** [comment]
The `Unknown Resource` might be a separate unrelated issue. It looks like the failure mode here is systemd Gateways on GCP. Some DNS Resources that are wildcards are not working for me, failing with the TCP retransmissions listed above in the pcap. Some domains are working (`dnsleaktest.com` and `ifconfig.net`), but in all cases I see a lot of TCP errors in the pcap for DNS Resources on GCP.

Doesn't seem to matter if it's IPv4 or IPv6. I'm curious if packets are somehow being fragmented or otherwise mangled in some way in the GCP network for specific Clients.

**Comment by jamilbk** [comment]
Gateway trace logs seem fine, lots of NAT entries but nothing obvious:

```
a)
Sep 18 05:43:22 gateway-7zhj sudo[2105]: 2024-09-18T05:43:22.155765Z DEBUG firezone_tunnel::peer::nat_table: NAT session expired inside=(Tcp(59075), fd00:2021:1111:8000::6) outside=(Tcp(59075), 2607:f8b0:400c:c08::93)
Sep 18 05:43:23 gateway-7zhj sudo[2105]: 2024-09-18T05:43:23.466446Z DEBUG firezone_tunnel::peer::nat_table: New NAT session inside=(Tcp(59091), fd00:2021:1111:8000::2) outside=(Tcp(59091), 2607:f8b0:400c:c07::bc)
Sep 18 05:43:25 gateway-7zhj sudo[2105]: 2024-09-18T05:43:25.155289Z DEBUG firezone_tunnel::peer::nat_table: NAT session expired inside=(Tcp(59077), fd00:2021:1111:8000::6) outside=(Tcp(59077), 2607:f8b0:400c:c08::93)
Sep 18 05:43:29 gateway-7zhj sudo[2105]: 2024-09-18T05:43:29.559095Z TRACE firezone_tunnel::peer::nat_table: Translating incoming packet inside=(Tcp(59163), fd00:2021:1111:8000::1a) outside=(Tcp(59163), 2607:f8b0:400c:c0f::8a)
Sep 18 05:43:29 gateway-7zhj sudo[2105]: 2024-09-18T05:43:29.638365Z TRACE firezone_tunnel::peer::nat_table: Translating outgoing packet inside=(Tcp(59163), fd00:2021:1111:8000::1a) outside=(Tcp(59163), 2607:f8b0:400c:c0f::8a)
Sep 18 05:43:29 gateway-7zhj sudo[2105]: 2024-09-18T05:43:29.638445Z TRACE firezone_tunnel::peer::nat_table: Translating outgoing packet inside=(Tcp(59163), fd00:2021:1111:8000::1a) outside=(Tcp(59163), 2607:f8b0:400c:c0f::8a)
Sep 18 05:43:29 gateway-7zhj sudo[2105]: 2024-09-18T05:43:29.639263Z DEBUG firezone_tunnel::peer::nat_table: New NAT session inside=(Tcp(59164), fd00:2021:1111:8000::1a) outside=(Tcp(59164), 2607:f8b0:400c:c0f::8a)
Sep 18 05:43:29 gateway-7zhj sudo[2105]: 2024-09-18T05:43:29.639835Z TRACE firezone_tunnel::peer::nat_table: Translating incoming packet inside=(Tcp(59164), fd00:2021:1111:8000::1a) outside=(Tcp(59164), 2607:f8b0:400c:c0f::8a)
Sep 18 05:43:29 gateway-7zhj sudo[2105]: 2024-09-18T05:43:29.720744Z TRACE firezone_tunnel::peer::nat_table: Translating outgoing packet inside=(Tcp(59164), fd00:2021:1111:8000::1a) outside=(Tcp(59164), 2607:f8b0:400c:c0f::8a)
Sep 18 05:43:29 gateway-7zhj sudo[2105]: 2024-09-18T05:43:29.720825Z TRACE firezone_tunnel::peer::nat_table: Translating outgoing packet inside=(Tcp(59164), fd00:2021:1111:8000::1a) outside=(Tcp(59164), 2607:f8b0:400c:c0f::8a)
Sep 18 05:43:29 gateway-7zhj sudo[2105]: 2024-09-18T05:43:29.721444Z TRACE firezone_tunnel::peer::nat_table: Translating incoming packet inside=(Tcp(59164), fd00:2021:1111:8000::1a) outside=(Tcp(59164), 2607:f8b0:400c:c0f::8a)
Sep 18 05:43:36 gateway-7zhj sudo[2105]: 2024-09-18T05:43:36.155986Z DEBUG firezone_tunnel::peer::nat_table: NAT session expired inside=(Tcp(59081), fd00:2021:1111:8000::6) outside=(Tcp(59081), 2607:f8b0:400c:c08::93)
Sep 18 05:43:37 gateway-7zhj sudo[2105]: 2024-09-18T05:43:37.633841Z DEBUG firezone_tunnel::peer::nat_table: New NAT session inside=(Tcp(59094), fd00:2021:1111:8000::22) outside=(Tcp(59094), 2607:f8b0:400c:c13::8a)
Sep 18 05:43:37 gateway-7zhj sudo[2105]: 2024-09-18T05:43:37.702876Z DEBUG firezone_tunnel::peer::nat_table: New NAT session inside=(Tcp(59093), fd00:2021:1111:8000::6) outside=(Tcp(59093), 2607:f8b0:400c:c08::93)
Sep 18 05:43:39 gateway-7zhj sudo[2105]: 2024-09-18T05:43:39.765677Z TRACE firezone_tunnel::peer::nat_table: Translating incoming packet inside=(Tcp(59164), fd00:2021:1111:8000::1a) outside=(Tcp(59164), 2607:f8b0:400c:c0f::8a)
Sep 18 05:43:39 gateway-7zhj sudo[2105]: 2024-09-18T05:43:39.846257Z TRACE firezone_tunnel::peer::nat_table: Translating outgoing packet inside=(Tcp(59164), fd00:2021:1111:8000::1a) outside=(Tcp(59164), 2607:f8b0:400c:c0f::8a)
Sep 18 05:43:39 gateway-7zhj sudo[2105]: 2024-09-18T05:43:39.846332Z TRACE firezone_tunnel::peer::nat_table: Translating outgoing packet inside=(Tcp(59164), fd00:2021:1111:8000::1a) outside=(Tcp(59164), 2607:f8b0:400c:c0f::8a)
Sep 18 05:43:41 gateway-7zhj sudo[2105]: 2024-09-18T05:43:41.687984Z DEBUG firezone_tunnel::peer::nat_table: New NAT session inside=(Tcp(59095), fd00:2021:1111:8000::6) outside=(Tcp(59095), 2607:f8b0:400c:c08::93)
Sep 18 05:43:42 gateway-7zhj sudo[2105]: 2024-09-18T05:43:42.155889Z DEBUG firezone_tunnel::peer::nat_table: NAT session expired inside=(Tcp(58868), fd00:2021:1111:8000::32) outside=(Tcp(58868), 10.129.0.2)
Sep 18 05:43:42 gateway-7zhj sudo[2105]: 2024-09-18T05:43:42.155932Z DEBUG firezone_tunnel::peer::nat_table: NAT session expired inside=(Tcp(58875), fd00:2021:1111:8000::32) outside=(Tcp(58875), 10.129.0.2)
Sep 18 05:43:42 gateway-7zhj sudo[2105]: 2024-09-18T05:43:42.155940Z DEBUG firezone_tunnel::peer::nat_table: NAT session expired inside=(Tcp(58876), fd00:2021:1111:8000::32) outside=(Tcp(58876), 10.129.0.2)
Sep 18 05:43:45 gateway-7zhj sudo[2105]: 2024-09-18T05:43:45.767024Z DEBUG firezone_tunnel::peer::nat_table: New NAT session inside=(Tcp(59096), fd00:2021:1111:8000::22) outside=(Tcp(59096), 2607:f8b0:400c:c13::8a)
```

**Comment by jamilbk** [comment]
Probably unrelated / not the root cause of #6767 or #6768
