### ISSUE TITLE
Allocation may go into unusable state if disconnected during ICE

### ISSUE THREAD

**Issue by jamilbk** [CloudFire-LLC/cloudfire#7763]
Now that we have more Relays online, we may have uncovered a race condition between the portal `relays_presence` messages and connlib's Relay tracking logic.

The first instance of this occurring was late last night:

```
Jan 15 08:00:38 perf-atlanta sudo[3148364]: 2025-01-15T08:00:38.150Z DEBUG snownet::node: Unknown relay rid=9e5b5892-9d00-4c7a-9e8f-da6e80c8606d cid=dbd1100b-3bfc-472a-bb6c-ca825c6ca799
```

This is on Gateway 1.4.2 (perf.gateway.firez.one) on Vultr.

Full logs are attached here for further investigation.

The Gateway is currently showing online but can't establish any connections as it has no valid Relay. Multiple deploys have occurred since this started, without resolving, so the issue seems to not be relieved by deploys and further relays_presence messages.

[gateway.log.gz](https://github.com/user-attachments/files/18426949/gateway.log.gz)

**Comment by thomaseizinger** [comment]
Seeing many of these in the logs:

```
2025-01-15T08:19:36.355Z DEBUG firezone_gateway::eventloop: Failed to authorise flow: No TURN servers available
2025-01-15T08:19:36.355Z DEBUG phoenix_channel: Connecting to portal host=api.firez.one user_agent=Debian/12.0.0 connlib/1.4.2 (x86_64; 6.1.0-22-amd64)
2025-01-15T08:19:36.392Z DEBUG tungstenite::handshake::client: Client handshake done.
2025-01-15T08:19:36.392Z  INFO phoenix_channel: Connected to portal host=api.firez.one
2025-01-15T08:19:36.408Z  INFO snownet::node: Added new TURN server rid=9e5b5892-9d00-4c7a-9e8f-da6e80c8606d address=Dual { v4: 35.243.130.135:3478, v6: [2600:1900:4021:6e9:0:8::]:3478 }
2025-01-15T08:19:36.408Z  INFO snownet::node: Added new TURN server rid=a09e3a22-ad77-4ba7-9c5f-af6be2fbee29 address=Dual { v4: 34.162.189.69:3478, v6: [2600:1901:8130:314:0:8::]:3478 }
```

The self-healing mechanism triggers but we always get assigned the same relays and they don't appear to respond so we disconnect again:

```
2025-01-15T08:19:48.129Z  WARN snownet::node: Disconnecting from relay; no response received. Is STUN blocked? rid=9e5b5892-9d00-4c7a-9e8f-da6e80c8606d
2025-01-15T08:19:48.130Z  WARN snownet::node: Disconnecting from relay; no response received. Is STUN blocked? rid=a09e3a22-ad77-4ba7-9c5f-af6be2fbee29
2025-01-15T08:19:48.130Z DEBUG snownet::node: Selected relay disconnected during ICE; connection may fail cid=dbd1100b-3bfc-472a-bb6c-ca825c6ca799
2025-01-15T08:19:48.130Z DEBUG snownet::node: Unknown relay rid=a09e3a22-ad77-4ba7-9c5f-af6be2fbee29 cid=dbd1100b-3bfc-472a-bb6c-ca825c6ca799
2025-01-15T08:19:48.130Z DEBUG snownet::node: Selected relay disconnected during ICE; connection may fail cid=dbd1100b-3bfc-472a-bb6c-ca825c6ca799
2025-01-15T08:19:48.130Z DEBUG snownet::node: Selected relay disconnected during ICE; connection may fail cid=dbd1100b-3bfc-472a-bb6c-ca825c6ca799
2025-01-15T08:19:48.130Z DEBUG snownet::node: Unknown relay rid=a09e3a22-ad77-4ba7-9c5f-af6be2fbee29 cid=dbd1100b-3bfc-472a-bb6c-ca825c6ca799
```

**Comment by thomaseizinger** [comment]
What is really bizarre is that this looks like it would be fixed by #7768 however, the regression was only introduced in `main` and in 1.4.2, this should not be present.

**Comment by jamilbk** [comment]
Good find! I always felt like there might still be a disconnect with how we presumed the Relays and Portal to interact during a deploy and how it actually happens.

We do have Elixir unit tests for this... I'll see if I can model some expected rollover patterns there to make sure it's working as intended.

My hunch is that either the portal or connlib has a state tracking bug that was uncovered by adding more Relays. Possibly related to #7740

**Comment by jamilbk** [comment]
Ok, I spun up a gateway from `main` just now, connected to a bare site (no resources), with `RUST_LOG=debug,phoenix_channel=trace,wire=trace`, and ran a deploy, to capture as minimal a log as possible.

Here's the result: 

[run1.log.zip](https://github.com/user-attachments/files/18450078/run1.log.zip)

I believe it captures the issue, as the Gateway ends up in a state where it's trying to connect to a Relay that is no longer responding.

I'm still not sure if the issue is from the `relays_presence` being incorrect or something to do with the Gateway / Relay bind logic. Will take a closer look through the logs tomorrow.

**Comment by thomaseizinger** [comment]
Thanks! I'll take a look through that too.

**Comment by jamilbk** [comment]
~~Is this a problem? It appears that we are creating duplicate bindings for each GSO thread.~~ Edit: I misread the logs.

It `Allocation mismatch` error at each refresh interval.

The first ~50 minutes of the log are just the Gateway idling. Around `2025-01-17T06:38:07.306Z` we see the first `relays_presence`.

Before that occurs (so unaffected by the deploy, just an idle Gateway), we see this pattern at each refresh interval:


```
2025-01-17T05:51:05.071Z DEBUG snownet::allocation: Allocation is due for a refresh active_socket=Some(34.102.59.252:3478)
2025-01-17T05:51:05.072Z TRACE wire::net::send: src=None dst=34.102.59.252:3478 num_packets=1 segment_size=240
2025-01-17T05:51:05.088Z DEBUG snownet::allocation: Allocation is due for a refresh active_socket=Some([2600:1900:4180:699:0:12::]:3478)
2025-01-17T05:51:05.088Z TRACE wire::net::send: src=None dst=[2600:1900:4180:699:0:12::]:3478 num_packets=1 segment_size=240
2025-01-17T05:51:05.092Z TRACE wire::net::recv: src=34.102.59.252:3478 dst=10.211.55.5:48135 num_packets=1 segment_size=72 trailing_bytes=0
2025-01-17T05:51:05.093Z DEBUG snownet::allocation: request=["RequestedTransport(17)", "AdditionalAddressFamily(V6)", "Software(snownet; session=DC36611BBA8CE3C45FFEF350741D3E7C7B2810104645AED2863D54F5C53067F7)", "Username(1738302364:z4jH9o0u87iWSJ1c4X1bnA)", "Realm(firezone)", "Nonce(deeaa025-75bd-de8a-9e25-3f2193b24303)", "MessageIntegrity(395B954DA05F4B18C9BAA5E3CD6340F2C7CEA7EE)"] response=["ErrorCode(437, Allocation Mismatch)", "MessageIntegrity(9FCD45EA54E50A3F2AE8606F581CFCEBED9E8110)"] from=34.102.59.252:3478 tid=A7046A48950032116B848BE2 method=refresh class=error response rtt=21.494388ms
2025-01-17T05:51:05.093Z  INFO snownet::allocation: Invalidating allocation active_socket=Some(34.102.59.252:3478) from=34.102.59.252:3478 tid=A7046A48950032116B848BE2 method=refresh class=error response rtt=21.494388ms
2025-01-17T05:51:05.093Z DEBUG snownet::allocation: Making new allocation to re-sync from=34.102.59.252:3478 tid=A7046A48950032116B848BE2 method=refresh class=error response rtt=21.494388ms
2025-01-17T05:51:05.093Z TRACE wire::net::send: src=None dst=34.102.59.252:3478 num_packets=1 segment_size=240
2025-01-17T05:51:05.111Z TRACE wire::net::recv: src=34.102.59.252:3478 dst=10.211.55.5:48135 num_packets=1 segment_size=100 trailing_bytes=0
2025-01-17T05:51:05.112Z DEBUG snownet::allocation: request=["RequestedTransport(17)", "AdditionalAddressFamily(V6)", "Software(snownet; session=DC36611BBA8CE3C45FFEF350741D3E7C7B2810104645AED2863D54F5C53067F7)", "Username(1738302364:z4jH9o0u87iWSJ1c4X1bnA)", "Realm(firezone)", "Nonce(deeaa025-75bd-de8a-9e25-3f2193b24303)", "MessageIntegrity(4D8010D71F676E3E1824D382841AEF4625E43D21)"] response=["XorRelayAddress(34.102.59.252:65381)", "XorRelayAddress([2600:1900:4120:76b5:0:12::]:65381)", "XorMappedAddress(107.197.104.68:54369)", "Lifetime(600s)", "MessageIntegrity(3CB04A1AEF166AF4CDA70E387665F15E1AD2BF72)"] from=34.102.59.252:3478 tid=A13E7DD20035202A2630B1AA method=allocate class=success response rtt=18.703192ms
2025-01-17T05:51:05.112Z  INFO snownet::allocation: Updated allocation srflx_ip4=Some(107.197.104.68:55777) srflx_ip6=Some([2600:1700:3ecb:2410:49fc:4931:4ded:9ae9]:60743) relay_ip4=Some(34.102.59.252:65381) relay_ip6=Some([2600:1900:4120:76b5:0:12::]:65381) remaining_lifetime=Some(600s) from=34.102.59.252:3478 tid=A13E7DD20035202A2630B1AA method=allocate class=success response rtt=18.703192ms
2025-01-17T05:51:05.112Z TRACE wire::net::recv: src=[2600:1900:4180:699:0:12::]:3478 dst=[fdb2:2c26:f4e4:0:21c:42ff:fe84:4daa]:33933 num_packets=1 segment_size=72 trailing_bytes=0
2025-01-17T05:51:05.112Z DEBUG snownet::allocation: request=["RequestedTransport(17)", "AdditionalAddressFamily(V6)", "Software(snownet; session=DC36611BBA8CE3C45FFEF350741D3E7C7B2810104645AED2863D54F5C53067F7)", "Username(1738302364:FDmFr3_H5zaUU-GYoeLDRA)", "Realm(firezone)", "Nonce(a60d4d7c-7514-de79-8c08-2a779059bc8c)", "MessageIntegrity(90F09FAE54AB8A6D1BB115DA47BC5F65ECF9A7D8)"] response=["ErrorCode(437, Allocation Mismatch)", "MessageIntegrity(7C7CA1F1F1F713B4AA853D771F662B38336FC852)"] from=[2600:1900:4180:699:0:12::]:3478 tid=6A6EAA1DB766479A4D2E91D1 method=refresh class=error response rtt=24.109506ms
2025-01-17T05:51:05.112Z  INFO snownet::allocation: Invalidating allocation active_socket=Some([2600:1900:4180:699:0:12::]:3478) from=[2600:1900:4180:699:0:12::]:3478 tid=6A6EAA1DB766479A4D2E91D1 method=refresh class=error response rtt=24.109506ms
2025-01-17T05:51:05.112Z DEBUG snownet::allocation: Making new allocation to re-sync from=[2600:1900:4180:699:0:12::]:3478 tid=6A6EAA1DB766479A4D2E91D1 method=refresh class=error response rtt=24.109506ms
2025-01-17T05:51:05.112Z TRACE wire::net::send: src=None dst=[2600:1900:4180:699:0:12::]:3478 num_packets=1 segment_size=240
2025-01-17T05:51:05.132Z TRACE wire::net::recv: src=[2600:1900:4180:699:0:12::]:3478 dst=[fdb2:2c26:f4e4:0:21c:42ff:fe84:4daa]:33933 num_packets=1 segment_size=112 trailing_bytes=0
2025-01-17T05:51:05.133Z DEBUG snownet::allocation: request=["RequestedTransport(17)", "AdditionalAddressFamily(V6)", "Software(snownet; session=DC36611BBA8CE3C45FFEF350741D3E7C7B2810104645AED2863D54F5C53067F7)", "Username(1738302364:FDmFr3_H5zaUU-GYoeLDRA)", "Realm(firezone)", "Nonce(a60d4d7c-7514-de79-8c08-2a779059bc8c)", "MessageIntegrity(D17EF43B45A031268BD49617DCCBEB904D50826E)"] response=["XorRelayAddress(34.16.253.208:52968)", "XorRelayAddress([2600:1900:4180:699:0:12::]:52968)", "XorMappedAddress([2600:1700:3ecb:2410:49fc:4931:4ded:9ae9]:52433)", "Lifetime(600s)", "MessageIntegrity(35772522FF9634E25174EE324A63A479A8169B02)"] from=[2600:1900:4180:699:0:12::]:3478 tid=22667E1C48FB1293CB97FB73 method=allocate class=success response rtt=20.382593ms
2025-01-17T05:51:05.133Z  INFO snownet::allocation: Updated allocation srflx_ip4=Some(107.197.104.68:55777) srflx_ip6=Some([2600:1700:3ecb:2410:49fc:4931:4ded:9ae9]:60743) relay_ip4=Some(34.16.253.208:52968) relay_ip6=Some([2600:1900:4180:699:0:12::]:52968) remaining_lifetime=Some(600s) from=[2600:1900:4180:699:0:12::]:3478 tid=22667E1C48FB1293CB97FB73 method=allocate class=success response rtt=20.382593ms
```

I'm not sure if that's the primary issue, but it appears to be _something_ at least.

**Comment by jamilbk** [comment]
Another thing I noticed, probably working as intended, but thought I'd check. Consider the following sequence (which is present in the above log):

1. connlib receives relays_presence with Relays A, B and adds them
2. connlib reconnects to portal and receives Relays B, C in init and adds them
3. Relay A is offline, but connlib keeps trying to communicate with it
4. The portal never sent a relays_presence to disconnect from Relay A because as far as it's concerned, connlib has an entirely new connection and it's only told connlib about B, C (because it's likely a new portal instance)

I'm not sure this is an issue per se because we can't just throw away Relays on portal reconnects (what if it's a temporary blip).

**Comment by thomaseizinger** [comment]
> 3\. Relay A is offline, but connlib keeps trying to communicate with it

To detect this, we refresh all allocations on every update to the relays and thus should disconnect from Relay A here pretty soon after:

https://github.com/firezone/firezone/blob/7d322d52dbb5fe07e5fc4031ec8e12d440549308/rust/connlib/snownet/src/node.rs#L702-L709

**Comment by thomaseizinger** [comment]
> ~Is this a problem? It appears that we are creating duplicate bindings for each GSO thread.~ Edit: I misread the logs.
> 
> It `Allocation mismatch` error at each refresh interval.
> 
> The first ~50 minutes of the log are just the Gateway idling. Around `2025-01-17T06:38:07.306Z` we see the first `relays_presence`.
> 
> Before that occurs (so unaffected by the deploy, just an idle Gateway), we see this pattern at each refresh interval:
> 
> ```
> 2025-01-17T05:51:05.071Z DEBUG snownet::allocation: Allocation is due for a refresh active_socket=Some(34.102.59.252:3478)
> 2025-01-17T05:51:05.072Z TRACE wire::net::send: src=None dst=34.102.59.252:3478 num_packets=1 segment_size=240
> 2025-01-17T05:51:05.088Z DEBUG snownet::allocation: Allocation is due for a refresh active_socket=Some([2600:1900:4180:699:0:12::]:3478)
> 2025-01-17T05:51:05.088Z TRACE wire::net::send: src=None dst=[2600:1900:4180:699:0:12::]:3478 num_packets=1 segment_size=240
> 2025-01-17T05:51:05.092Z TRACE wire::net::recv: src=34.102.59.252:3478 dst=10.211.55.5:48135 num_packets=1 segment_size=72 trailing_bytes=0
> 2025-01-17T05:51:05.093Z DEBUG snownet::allocation: request=["RequestedTransport(17)", "AdditionalAddressFamily(V6)", "Software(snownet; session=DC36611BBA8CE3C45FFEF350741D3E7C7B2810104645AED2863D54F5C53067F7)", "Username(1738302364:z4jH9o0u87iWSJ1c4X1bnA)", "Realm(firezone)", "Nonce(deeaa025-75bd-de8a-9e25-3f2193b24303)", "MessageIntegrity(395B954DA05F4B18C9BAA5E3CD6340F2C7CEA7EE)"] response=["ErrorCode(437, Allocation Mismatch)", "MessageIntegrity(9FCD45EA54E50A3F2AE8606F581CFCEBED9E8110)"] from=34.102.59.252:3478 tid=A7046A48950032116B848BE2 method=refresh class=error response rtt=21.494388ms
> 2025-01-17T05:51:05.093Z  INFO snownet::allocation: Invalidating allocation active_socket=Some(34.102.59.252:3478) from=34.102.59.252:3478 tid=A7046A48950032116B848BE2 method=refresh class=error response rtt=21.494388ms
> 2025-01-17T05:51:05.093Z DEBUG snownet::allocation: Making new allocation to re-sync from=34.102.59.252:3478 tid=A7046A48950032116B848BE2 method=refresh class=error response rtt=21.494388ms
> 2025-01-17T05:51:05.093Z TRACE wire::net::send: src=None dst=34.102.59.252:3478 num_packets=1 segment_size=240
> 2025-01-17T05:51:05.111Z TRACE wire::net::recv: src=34.102.59.252:3478 dst=10.211.55.5:48135 num_packets=1 segment_size=100 trailing_bytes=0
> 2025-01-17T05:51:05.112Z DEBUG snownet::allocation: request=["RequestedTransport(17)", "AdditionalAddressFamily(V6)", "Software(snownet; session=DC36611BBA8CE3C45FFEF350741D3E7C7B2810104645AED2863D54F5C53067F7)", "Username(1738302364:z4jH9o0u87iWSJ1c4X1bnA)", "Realm(firezone)", "Nonce(deeaa025-75bd-de8a-9e25-3f2193b24303)", "MessageIntegrity(4D8010D71F676E3E1824D382841AEF4625E43D21)"] response=["XorRelayAddress(34.102.59.252:65381)", "XorRelayAddress([2600:1900:4120:76b5:0:12::]:65381)", "XorMappedAddress(107.197.104.68:54369)", "Lifetime(600s)", "MessageIntegrity(3CB04A1AEF166AF4CDA70E387665F15E1AD2BF72)"] from=34.102.59.252:3478 tid=A13E7DD20035202A2630B1AA method=allocate class=success response rtt=18.703192ms
> 2025-01-17T05:51:05.112Z  INFO snownet::allocation: Updated allocation srflx_ip4=Some(107.197.104.68:55777) srflx_ip6=Some([2600:1700:3ecb:2410:49fc:4931:4ded:9ae9]:60743) relay_ip4=Some(34.102.59.252:65381) relay_ip6=Some([2600:1900:4120:76b5:0:12::]:65381) remaining_lifetime=Some(600s) from=34.102.59.252:3478 tid=A13E7DD20035202A2630B1AA method=allocate class=success response rtt=18.703192ms
> 2025-01-17T05:51:05.112Z TRACE wire::net::recv: src=[2600:1900:4180:699:0:12::]:3478 dst=[fdb2:2c26:f4e4:0:21c:42ff:fe84:4daa]:33933 num_packets=1 segment_size=72 trailing_bytes=0
> 2025-01-17T05:51:05.112Z DEBUG snownet::allocation: request=["RequestedTransport(17)", "AdditionalAddressFamily(V6)", "Software(snownet; session=DC36611BBA8CE3C45FFEF350741D3E7C7B2810104645AED2863D54F5C53067F7)", "Username(1738302364:FDmFr3_H5zaUU-GYoeLDRA)", "Realm(firezone)", "Nonce(a60d4d7c-7514-de79-8c08-2a779059bc8c)", "MessageIntegrity(90F09FAE54AB8A6D1BB115DA47BC5F65ECF9A7D8)"] response=["ErrorCode(437, Allocation Mismatch)", "MessageIntegrity(7C7CA1F1F1F713B4AA853D771F662B38336FC852)"] from=[2600:1900:4180:699:0:12::]:3478 tid=6A6EAA1DB766479A4D2E91D1 method=refresh class=error response rtt=24.109506ms
> 2025-01-17T05:51:05.112Z  INFO snownet::allocation: Invalidating allocation active_socket=Some([2600:1900:4180:699:0:12::]:3478) from=[2600:1900:4180:699:0:12::]:3478 tid=6A6EAA1DB766479A4D2E91D1 method=refresh class=error response rtt=24.109506ms
> 2025-01-17T05:51:05.112Z DEBUG snownet::allocation: Making new allocation to re-sync from=[2600:1900:4180:699:0:12::]:3478 tid=6A6EAA1DB766479A4D2E91D1 method=refresh class=error response rtt=24.109506ms
> 2025-01-17T05:51:05.112Z TRACE wire::net::send: src=None dst=[2600:1900:4180:699:0:12::]:3478 num_packets=1 segment_size=240
> 2025-01-17T05:51:05.132Z TRACE wire::net::recv: src=[2600:1900:4180:699:0:12::]:3478 dst=[fdb2:2c26:f4e4:0:21c:42ff:fe84:4daa]:33933 num_packets=1 segment_size=112 trailing_bytes=0
> 2025-01-17T05:51:05.133Z DEBUG snownet::allocation: request=["RequestedTransport(17)", "AdditionalAddressFamily(V6)", "Software(snownet; session=DC36611BBA8CE3C45FFEF350741D3E7C7B2810104645AED2863D54F5C53067F7)", "Username(1738302364:FDmFr3_H5zaUU-GYoeLDRA)", "Realm(firezone)", "Nonce(a60d4d7c-7514-de79-8c08-2a779059bc8c)", "MessageIntegrity(D17EF43B45A031268BD49617DCCBEB904D50826E)"] response=["XorRelayAddress(34.16.253.208:52968)", "XorRelayAddress([2600:1900:4180:699:0:12::]:52968)", "XorMappedAddress([2600:1700:3ecb:2410:49fc:4931:4ded:9ae9]:52433)", "Lifetime(600s)", "MessageIntegrity(35772522FF9634E25174EE324A63A479A8169B02)"] from=[2600:1900:4180:699:0:12::]:3478 tid=22667E1C48FB1293CB97FB73 method=allocate class=success response rtt=20.382593ms
> 2025-01-17T05:51:05.133Z  INFO snownet::allocation: Updated allocation srflx_ip4=Some(107.197.104.68:55777) srflx_ip6=Some([2600:1700:3ecb:2410:49fc:4931:4ded:9ae9]:60743) relay_ip4=Some(34.16.253.208:52968) relay_ip6=Some([2600:1900:4180:699:0:12::]:52968) remaining_lifetime=Some(600s) from=[2600:1900:4180:699:0:12::]:3478 tid=22667E1C48FB1293CB97FB73 method=allocate class=success response rtt=20.382593ms
> ```
> 
> I'm not sure if that's the primary issue, but it appears to be _something_ at least.

`connlib` reacts correctly here, if we see 437, we must throw away the state. The question is, why does the relay answer with 437? Has the relay already rebooted and thus lost its state? Did the client change IP / port and we didn't notice? Is there a bug in the relay?

Do we still have logs of that relay instance or has it been rolled over? Search for the transaction ID / snownet session ID should reveal what the relay was doing at the time.

**Comment by jamilbk** [comment]
> Has the relay already rebooted and thus lost its state?

At least this part shouldn't be a factor for the first 30 minutes of the logs.

I believe we should still have Cloud Logging logs for this. Will investigate further.

**Comment by jamilbk** [comment]
> The question is, why does the relay answer with 437?

Ok, so this particular mystery is solved. After checking Logs explorer, it seems that upon each refresh interval, my Gateway has a new source port and thus appears as a new sender. 5 minutes must be greater than the UDP NAT session duration for the Parallels VM NAT implementation.

This has me wondering though. If we're actively Relaying traffic under these conditions (such as the NAT Gateway in AWS which probably exhibits similar characteristics), wouldn't that cause a massive latency spike upon each refresh interval while snownet makes a new allocation? So even for a very busy Gateway behind a restrictive NAT, all clients will experience a latency spike (or connection drop) every ~5 minutes.

For most UDP protocols I believe they use a keepalive timer of under < 30s as this is commonly found to be reliable under virtually any NAT setup on the Internet. (Examples: WireGuard recommended Keepalive is 25s, Phoenix heartbeat is 30s).

I know this is offtopic by now, but isn't this an issue? Should we be setting the TURN refresh interval to 25s instead of 300s?

**Comment by jamilbk** [comment]
Going to re-run this experiment in Docker Desktop on Mac (which has a better-behaved NAT implementation) and post results here. It will be IPv4-only due to [lack of IPv6 support](https://github.com/docker/for-mac/issues/1432), but I suspect this bug isn't affect by IP stack.

**Comment by jamilbk** [comment]
Found the issue. Seems like there is some kind of firewall rate limiting or blocking happening after the initial allocation and the Gateway then disconnects from all of its Relays:


```
firezone-gateway-1  | 2025-01-18T17:36:48.736Z DEBUG snownet::allocation: Allocation is due for a refresh active_socket=Some(34.16.253.208:3478)
firezone-gateway-1  | 2025-01-18T17:36:48.736Z TRACE wire::net::send: src=None dst=34.16.253.208:3478 num_packets=1 segment_size=240
firezone-gateway-1  | 2025-01-18T17:36:49.729Z DEBUG snownet::allocation: Request timed out after 1s, re-sending id=TransactionId(0x5E95049B2214EBDFB590231C) method=refresh dst=34.102.71.236:3478 active_socket=Some(34.102.71.236:3478)
firezone-gateway-1  | 2025-01-18T17:36:49.729Z TRACE wire::net::send: src=None dst=34.102.71.236:3478 num_packets=1 segment_size=240
firezone-gateway-1  | 2025-01-18T17:36:49.740Z DEBUG snownet::allocation: Request timed out after 1s, re-sending id=TransactionId(0x647FF437C85117134800AC08) method=refresh dst=34.16.253.208:3478 active_socket=Some(34.16.253.208:3478)
firezone-gateway-1  | 2025-01-18T17:36:49.740Z TRACE wire::net::send: src=None dst=34.16.253.208:3478 num_packets=1 segment_size=240
firezone-gateway-1  | 2025-01-18T17:36:51.236Z DEBUG snownet::allocation: Request timed out after 1.5s, re-sending id=TransactionId(0xF1645EB0F173609A5FFA539B) method=refresh dst=34.102.71.236:3478 active_socket=Some(34.102.71.236:3478)
firezone-gateway-1  | 2025-01-18T17:36:51.236Z TRACE wire::net::send: src=None dst=34.102.71.236:3478 num_packets=1 segment_size=240
firezone-gateway-1  | 2025-01-18T17:36:51.243Z DEBUG snownet::allocation: Request timed out after 1.5s, re-sending id=TransactionId(0x9B517114AF2C2FE6458818C3) method=refresh dst=34.16.253.208:3478 active_socket=Some(34.16.253.208:3478)
firezone-gateway-1  | 2025-01-18T17:36:51.243Z TRACE wire::net::send: src=None dst=34.16.253.208:3478 num_packets=1 segment_size=240
firezone-gateway-1  | 2025-01-18T17:36:53.491Z DEBUG snownet::allocation: Request timed out after 2.25s, re-sending id=TransactionId(0xC75DF953DF7EFB40AF8CE169) method=refresh dst=34.102.71.236:3478 active_socket=Some(34.102.71.236:3478)
firezone-gateway-1  | 2025-01-18T17:36:53.491Z TRACE wire::net::send: src=None dst=34.102.71.236:3478 num_packets=1 segment_size=240
firezone-gateway-1  | 2025-01-18T17:36:53.495Z DEBUG snownet::allocation: Request timed out after 2.25s, re-sending id=TransactionId(0x8BED7CE54BD728407594D1F0) method=refresh dst=34.16.253.208:3478 active_socket=Some(34.16.253.208:3478)
firezone-gateway-1  | 2025-01-18T17:36:53.495Z TRACE wire::net::send: src=None dst=34.16.253.208:3478 num_packets=1 segment_size=240
firezone-gateway-1  | 2025-01-18T17:36:56.873Z DEBUG snownet::allocation: Request timed out after 3.375s, re-sending id=TransactionId(0x3AA8C2B1B986981F4B113E16) method=refresh dst=34.16.253.208:3478 active_socket=Some(34.16.253.208:3478)
firezone-gateway-1  | 2025-01-18T17:36:56.873Z DEBUG snownet::allocation: Unable to queue refresh because we've exceeded its backoffs active_socket=Some(34.16.253.208:3478)
firezone-gateway-1  | 2025-01-18T17:36:56.873Z  INFO snownet::allocation: Invalidating allocation active_socket=None active_socket=Some(34.16.253.208:3478)
firezone-gateway-1  | 2025-01-18T17:36:56.873Z DEBUG snownet::allocation: Request timed out after 3.375s, re-sending id=TransactionId(0xACBA62F213E7FF5A0F14B86E) method=refresh dst=34.102.71.236:3478 active_socket=Some(34.102.71.236:3478)
firezone-gateway-1  | 2025-01-18T17:36:56.873Z DEBUG snownet::allocation: Unable to queue refresh because we've exceeded its backoffs active_socket=Some(34.102.71.236:3478)
firezone-gateway-1  | 2025-01-18T17:36:56.873Z  INFO snownet::allocation: Invalidating allocation active_socket=None active_socket=Some(34.102.71.236:3478)
firezone-gateway-1  | 2025-01-18T17:36:56.873Z  INFO snownet::node: Disconnecting from relay; no response received. Is STUN blocked? rid=4390350c-4304-4ce6-9ceb-f18e0b6037bd
firezone-gateway-1  | 2025-01-18T17:36:56.873Z  INFO snownet::node: Disconnecting from relay; no response received. Is STUN blocked? rid=51e23f1b-1677-4c92-bbe6-69de9672e7dc
```

It doesn't happen for all Gateways, seems intermittent. I'll double-check the Terraform config.

**Comment by jamilbk** [comment]
Ok, I think I found the issue. Contrary to what the `wire=trace` log above shows, WireShark caputring on my local network interface reports **no packets being sent** after the initial allocation.

Proof: Here's the pcap relating to a similar log scenario above. You can see the initial allocation request-response communication, but afterwards (after waiting > 10 minutes), no more data is sent.

<img width="2347" alt="Image" src="https://github.com/user-attachments/assets/41a9d935-0c9a-467f-8544-f16b17fd3e78" />

@thomaseizinger Is it possible the refresh packets get stuck in a buffer or queue somewhere? Perhaps related to the recent buffer pool / GSO changes?

**Comment by jamilbk** [comment]
Notably, the wireshark capture doesn't show the packets corresponding to the `Request timed out after 3.375s, re-sending` logs above. Something is amiss.

**Comment by jamilbk** [comment]
I can confirm this is an issue with 1.4.2 as well. See the refresh packets not reflected in the WireShark capture below:

<img width="2953" alt="Image" src="https://github.com/user-attachments/assets/e91101d9-1f2b-4092-9758-3a300b9d8bca" />

**Comment by jamilbk** [comment]
The plot thickens! Here are some more data points:

| Environment | Gateway version | Gateway deployment | Result |
| --- | --- | --- | --- |
| test | `main` | Docker on Linux | [Allocation refresh successful](https://github.com/firezone/firezone/pull/7804) |
| staging | `main` | Docker on Mac | **Failed** |
| staging | `1.4.2` | Docker on Mac | **Failed** |
| staging | `1.4.1` | Docker on Mac | **Failed** |
| staging | `1.4.0` | Docker on Mac | **Failed** |
| staging | `1.3.2` | Docker on Mac | **Failed** |
| staging | `1.3.1` | Docker on Mac | **Failed** |
| staging | `1.3.0` | Docker on Mac | **Failed** |
| staging | `1.2.0` | Docker on Mac | **Failed** |
| staging | `1.1.5` | Docker on Mac | **Failed** |
| staging | `1.1.0` | Docker on Mac | **Failed** |
| staging | `1.4.2` | Systemd on Debian 12 | **Failed** (intermittent?) |
| production | `main` | Docker on Mac | **Failed** |

At this point, I'm baffled. Granted, we don't support (or test) the Gateway on Docker for Mac, but has this really been an issue for this long? I can't think of any reason why WireShark would capture the initial setup and not the subsequent refresh requests, so surely that can't be the issue?

The websocket keepalives are sent and replied to just fine, so it's not an inherent issue with connectivity.

I tested against production with the same result, so it's not a firewall or infra related issue too.

**Comment by thomaseizinger** [comment]
> I can confirm this is an issue with 1.4.2 as well. See the refresh packets not reflected in the WireShark capture below:
> <img alt="Image" width="2000" src="https://private-user-images.githubusercontent.com/167144/404556012-e91101d9-1f2b-4092-9758-3a300b9d8bca.png?jwt=eyJhbGciOiJIUzI1NiIsInR5cCI6IkpXVCJ9.eyJpc3MiOiJnaXRodWIuY29tIiwiYXVkIjoicmF3LmdpdGh1YnVzZXJjb250ZW50LmNvbSIsImtleSI6ImtleTUiLCJleHAiOjE3MzczMDI3OTQsIm5iZiI6MTczNzMwMjQ5NCwicGF0aCI6Ii8xNjcxNDQvNDA0NTU2MDEyLWU5MTEwMWQ5LTFmMmItNDA5Mi05NzU4LTNhMzAwYjlkOGJjYS5wbmc_WC1BbXotQWxnb3JpdGhtPUFXUzQtSE1BQy1TSEEyNTYmWC1BbXotQ3JlZGVudGlhbD1BS0lBVkNPRFlMU0E1M1BRSzRaQSUyRjIwMjUwMTE5JTJGdXMtZWFzdC0xJTJGczMlMkZhd3M0X3JlcXVlc3QmWC1BbXotRGF0ZT0yMDI1MDExOVQxNjAxMzRaJlgtQW16LUV4cGlyZXM9MzAwJlgtQW16LVNpZ25hdHVyZT05ZmNkNzMwMTk1ZDUxYzQ0MmJjMmJiZjQ2MWY4NWE5NGRkM2Q0MGZiMjA2ODRiMWQyY2M0NzBjNTQwMjYzODIyJlgtQW16LVNpZ25lZEhlYWRlcnM9aG9zdCJ9.TkUoW07eO_KrSe4mn9DjhEPambRoQcFsSxVcy6D7vJo">

The findings in #7802 still don't explain why these packets are never sent on the socket / not captured in WireGuard.

**Comment by jamilbk** [comment]
> The findings in [#7802](https://github.com/firezone/firezone/issues/7802) still don't explain why these packets are never sent on the socket / not captured in WireGuard.

Indeed. This is very strange.

One more data point that seems to restore (some) order to the universe. Capturing the STUN traffic inside the container itself with `tcpdump` indicates the packets _are_ arriving at the Docker interface just fine.

WireShark isn't seeing them leave the host because the Docker network is somehow dropping the refresh requests. Testing with `tcpdump` on my Macbook host does **not** see them leave. 

Here are the refresh requests inside the container:

```
/bin # tcpdump -v -i eth0 port 3478
tcpdump: listening on eth0, link-type EN10MB (Ethernet), snapshot length 262144 bytes

17:18:18.356673 IP (tos 0x0, ttl 64, id 0, offset 0, flags [DF], proto UDP (17), length 268)
    b38c6f9b8e94.38238 > 207.86.94.34.bc.googleusercontent.com.3478: UDP, length 240
17:18:18.375592 IP (tos 0x0, ttl 64, id 0, offset 0, flags [DF], proto UDP (17), length 268)
    b38c6f9b8e94.38238 > 208.253.16.34.bc.googleusercontent.com.3478: UDP, length 240
17:18:19.358647 IP (tos 0x0, ttl 64, id 0, offset 0, flags [DF], proto UDP (17), length 268)
    b38c6f9b8e94.38238 > 207.86.94.34.bc.googleusercontent.com.3478: UDP, length 240
17:18:19.382673 IP (tos 0x0, ttl 64, id 0, offset 0, flags [DF], proto UDP (17), length 268)
    b38c6f9b8e94.38238 > 208.253.16.34.bc.googleusercontent.com.3478: UDP, length 240
17:18:20.863039 IP (tos 0x0, ttl 64, id 0, offset 0, flags [DF], proto UDP (17), length 268)
    b38c6f9b8e94.38238 > 207.86.94.34.bc.googleusercontent.com.3478: UDP, length 240
17:18:20.885230 IP (tos 0x0, ttl 64, id 0, offset 0, flags [DF], proto UDP (17), length 268)
    b38c6f9b8e94.38238 > 208.253.16.34.bc.googleusercontent.com.3478: UDP, length 240
17:18:23.119420 IP (tos 0x0, ttl 64, id 0, offset 0, flags [DF], proto UDP (17), length 268)
    b38c6f9b8e94.38238 > 207.86.94.34.bc.googleusercontent.com.3478: UDP, length 240
17:18:23.138243 IP (tos 0x0, ttl 64, id 0, offset 0, flags [DF], proto UDP (17), length 268)
    b38c6f9b8e94.38238 > 208.253.16.34.bc.googleusercontent.com.3478: UDP, length 240
```

Here is the initial allocation setup captured on the host:

```
jamil@Airbook-Mac:~/tmp/gateway-rollover % sudo tcpdump -vvv -i en4 port 3478
tcpdump: listening on en4, link-type EN10MB (Ethernet), snapshot length 524288 bytes
09:23:03.019167 IP (tos 0x0, ttl 64, id 6573, offset 0, flags [none], proto UDP (17), length 136)
    airbook-mac.attlocal.net.62693 > 208.253.16.34.bc.googleusercontent.com.nat-stun-port: [udp sum ok] UDP, length 108
09:23:03.019475 IP (tos 0x0, ttl 64, id 1713, offset 0, flags [none], proto UDP (17), length 136)
    airbook-mac.attlocal.net.49401 > 207.86.94.34.bc.googleusercontent.com.nat-stun-port: [udp sum ok] UDP, length 108
09:23:03.038551 IP (tos 0x0, ttl 57, id 45049, offset 0, flags [DF], proto UDP (17), length 60)
    207.86.94.34.bc.googleusercontent.com.nat-stun-port > airbook-mac.attlocal.net.49401: [udp sum ok] UDP, length 32
09:23:03.039673 IP (tos 0x0, ttl 64, id 22331, offset 0, flags [none], proto UDP (17), length 228)
    airbook-mac.attlocal.net.49401 > 207.86.94.34.bc.googleusercontent.com.nat-stun-port: [udp sum ok] UDP, length 200
09:23:03.042846 IP (tos 0x0, ttl 57, id 13298, offset 0, flags [DF], proto UDP (17), length 60)
    208.253.16.34.bc.googleusercontent.com.nat-stun-port > airbook-mac.attlocal.net.62693: [udp sum ok] UDP, length 32
09:23:03.043719 IP (tos 0x0, ttl 64, id 44236, offset 0, flags [none], proto UDP (17), length 228)
    airbook-mac.attlocal.net.62693 > 208.253.16.34.bc.googleusercontent.com.nat-stun-port: [udp sum ok] UDP, length 200
09:23:03.054467 IP (tos 0x0, ttl 57, id 45069, offset 0, flags [DF], proto UDP (17), length 144)
    207.86.94.34.bc.googleusercontent.com.nat-stun-port > airbook-mac.attlocal.net.49401: [udp sum ok] UDP, length 116
09:23:03.055584 IP (tos 0x0, ttl 64, id 37572, offset 0, flags [none], proto UDP (17), length 268)
    airbook-mac.attlocal.net.49401 > 207.86.94.34.bc.googleusercontent.com.nat-stun-port: [udp sum ok] UDP, length 240
09:23:03.064179 IP (tos 0x0, ttl 57, id 13314, offset 0, flags [DF], proto UDP (17), length 144)
    208.253.16.34.bc.googleusercontent.com.nat-stun-port > airbook-mac.attlocal.net.62693: [udp sum ok] UDP, length 116
09:23:03.065408 IP (tos 0x0, ttl 64, id 4887, offset 0, flags [none], proto UDP (17), length 268)
    airbook-mac.attlocal.net.62693 > 208.253.16.34.bc.googleusercontent.com.nat-stun-port: [udp sum ok] UDP, length 240
09:23:03.070930 IP (tos 0x0, ttl 57, id 45071, offset 0, flags [DF], proto UDP (17), length 128)
    207.86.94.34.bc.googleusercontent.com.nat-stun-port > airbook-mac.attlocal.net.49401: [udp sum ok] UDP, length 100
09:23:03.085999 IP (tos 0x0, ttl 57, id 13335, offset 0, flags [DF], proto UDP (17), length 128)
    208.253.16.34.bc.googleusercontent.com.nat-stun-port > airbook-mac.attlocal.net.62693: [udp sum ok] UDP, length 100
```

**Comment by jamilbk** [comment]
Here is the docker-compose I'm using:


```yaml
services:
  firezone-gateway:
    # image: "ghcr.io/firezone/gateway:1.1.0"
    image: "us-east1-docker.pkg.dev/firezone-staging/firezone/gateway:latest"
    environment:
      # Use a unique ID for each Gateway in your Firezone account. If left blank,
      # the Gateway will generate a random ID saved in /var/lib/firezone
      - FIREZONE_ID=rollover1

      # REQUIRED. The token shown when deploying a Gateway in the admin portal.
      # staging
      - FIREZONE_TOKEN=<snip>

      # Configure log output. Other options are "trace", "debug", "info", "warn", "error", and "off".
      # See https://docs.rs/env_logger/latest/env_logger/ for more information.
      - RUST_LOG=debug,phoenix_channel=trace,wire=trace

      - FIREZONE_API_URL=wss://api.firez.one

      # Human-friendly name to use for this Gateway in the admin portal.
      # $(hostname) is used by default if not set.
      # - FIREZONE_NAME=<name-of-gateway>
    # volumes:
      # Persist the FIREZONE_ID. Can be omitted if FIREZONE_ID is set above.
      # - /var/lib/firezone:/var/lib/firezone
    cap_add:
      - NET_ADMIN
    sysctls:
      # Enable IP forwarding
      - net.ipv4.ip_forward=1
      - net.ipv4.conf.all.src_valid_mark=1
      - net.ipv6.conf.all.disable_ipv6=0
      - net.ipv6.conf.all.forwarding=1
      - net.ipv6.conf.default.forwarding=1
    healthcheck:
      test: ["CMD-SHELL", "ip link | grep tun-firezone"]
      interval: 5s
      timeout: 10s
      retries: 3
      start_period: 1m
    # devices:
    #   - /dev/net/tun:/dev/net/tun
    init: true

```

**Comment by thomaseizinger** [comment]
> One more data point that seems to restore (some) order to the universe. Capturing the STUN traffic inside the container itself with `tcpdump` indicates the packets _are_ arriving at the Docker interface just fine.
> 
> WireShark isn't seeing them leave the host because the Docker network is somehow dropping the refresh requests. Testing with `tcpdump` on my Macbook host does **not** see them leave.

Okay this is a big relief. The issue here seems to be Docker on Mac, perhaps coupled with the NAT binding? This explains why #7804 passes CI, right?

**Comment by jamilbk** [comment]
> Okay this is a big relief. The issue here seems to be Docker on Mac, perhaps coupled with the NAT binding? This explains why https://github.com/firezone/firezone/pull/7804 passes CI, right?

Yeah it does. The NAT binding issue happens under Parallels' VM NAT, so a different issue.

This is very strange though. Why would the Docker network simply decide to drop outbound traffic that was previously sent out just fine 5 minutes earlier?

I wonder if the iptables rules we're setting up are inadvertently causing this.

**Comment by jamilbk** [comment]
Opened #7818 to track the docker network issue and updated the title to reflect my current working theory: if a Relay disconnects during ICE (as what likely happened at the start of this issue), perhaps the Gateway enters a state where it no longer is able to communicate with _any_ Relays.

Investigating this a bit further today.

**Comment by jamilbk** [comment]
Ok, I think the above theory might be plausible. One major clue is that the Gateway (v1.4.2) has been in this failed state since the start of this issue and has not self-healed. See the most recent reconnection to the portal, the TURN servers being added, but no new allocations created as a result since the Gateway cannot reach them, as you noted originally:


```
853152 Jan 20 01:56:52 perf-atlanta sudo[3148364]: 2025-01-20T01:56:52.378Z DEBUG phoenix_channel: Reconnecting to portal on transient client error: websocket connection failed: IO error
 853152 : peer closed connection without sending TLS close_notify: https://docs.rs/rustls/latest/rustls/manual/_03_howto/index.html#unexpected-eof: peer closed connection without sending
 853152 TLS close_notify: https://docs.rs/rustls/latest/rustls/manual/_03_howto/index.html#unexpected-eof backoff=742.544246ms max_elapsed_time=None
 853153 Jan 20 01:56:53 perf-atlanta sudo[3148364]: 2025-01-20T01:56:53.122Z DEBUG phoenix_channel: Connecting to portal host=api.firez.one user_agent=Debian/12.0.0 connlib/1.4.2 (x86_64;
 853153  6.1.0-22-amd64)
 853154 Jan 20 01:56:53 perf-atlanta sudo[3148364]: 2025-01-20T01:56:53.164Z DEBUG tungstenite::handshake::client: Client handshake done.
 853155 Jan 20 01:56:53 perf-atlanta sudo[3148364]: 2025-01-20T01:56:53.164Z  INFO phoenix_channel: Connected to portal host=api.firez.one
 853156 Jan 20 01:56:53 perf-atlanta sudo[3148364]: 2025-01-20T01:56:53.189Z  INFO snownet::node: Added new TURN server rid=07b4a551-c9a6-486f-a601-6b7309eab3a8 address=Dual { v4: 34.23.5
 853156 5.188:3478, v6: [2600:1900:4021:6e9:0:15::]:3478 }
 853157 Jan 20 01:56:53 perf-atlanta sudo[3148364]: 2025-01-20T01:56:53.189Z  INFO snownet::node: Added new TURN server rid=a09e3a22-ad77-4ba7-9c5f-af6be2fbee29 address=Dual { v4: 34.162.
 853157 189.69:3478, v6: [2600:1901:8130:314:0:15::]:3478 }
 853158 Jan 20 01:56:53 perf-atlanta sudo[3148364]: 2025-01-20T01:56:53.191Z DEBUG firezone_bin_shared::tun_device_manager::linux: Successfully created ip rule for ipv4
 853159 Jan 20 01:56:53 perf-atlanta sudo[3148364]: 2025-01-20T01:56:53.192Z DEBUG firezone_bin_shared::tun_device_manager::linux: Successfully created ip rule for ipv6
 853160 Jan 20 01:56:53 perf-atlanta sudo[3148364]: 2025-01-20T01:56:53.192Z  INFO firezone_bin_shared::tun_device_manager::linux: Setting new routes new_routes={V6(Ipv6Network { network_
 853160 address: fd00:2021:1111::, netmask: 107 }), V4(Ipv4Network { network_address: 100.64.0.0, netmask: 11 })}
 853161 Jan 20 01:56:53 perf-atlanta sudo[3148364]: 2025-01-20T01:56:53.192Z DEBUG firezone_bin_shared::tun_device_manager::linux: Created new route route=100.64.0.0/11 iface_idx=39
 853162 Jan 20 02:44:18 perf-atlanta sudo[3148364]: 2025-01-20T02:44:18.098Z  INFO snownet::node: Removed TURN server rid=a09e3a22-ad77-4ba7-9c5f-af6be2fbee29 address=Dual { v4: 34.162.18
 853162 9.69:3478, v6: [2600:1901:8130:314:0:15::]:3478 }
 853163 Jan 20 02:44:18 perf-atlanta sudo[3148364]: 2025-01-20T02:44:18.098Z  INFO snownet::node: Replaced TURN server rid=07b4a551-c9a6-486f-a601-6b7309eab3a8 address=Dual { v4: 34.23.55
 853163 .188:3478, v6: [2600:1900:4021:6e9:0:15::]:3478 }
 853164 Jan 20 02:44:18 perf-atlanta sudo[3148364]: 2025-01-20T02:44:18.098Z  INFO snownet::node: Added new TURN server rid=dd0a166f-b44b-43e2-baf7-974b2880ffb6 address=Dual { v4: 34.145.
 853164 184.158:3478, v6: [2600:1900:4090:152:0:15::]:3478 }
 853165 Jan 20 14:15:29 perf-atlanta sudo[3148364]: 2025-01-20T14:15:29.728Z  INFO snownet::node: Removed TURN server rid=07b4a551-c9a6-486f-a601-6b7309eab3a8 address=Dual { v4: 34.23.55.
 853165 188:3478, v6: [2600:1900:4021:6e9:0:15::]:3478 }
 853166 Jan 20 14:15:29 perf-atlanta sudo[3148364]: 2025-01-20T14:15:29.728Z  INFO snownet::node: Added new TURN server rid=a09e3a22-ad77-4ba7-9c5f-af6be2fbee29 address=Dual { v4: 34.162.
 853166 189.69:3478, v6: [2600:1901:8130:314:0:15::]:3478 }
 853167 Jan 20 14:15:29 perf-atlanta sudo[3148364]: 2025-01-20T14:15:29.729Z  INFO snownet::node: Replaced TURN server rid=dd0a166f-b44b-43e2-baf7-974b2880ffb6 address=Dual { v4: 34.145.1
 853167 84.158:3478, v6: [2600:1900:4090:152:0:15::]:3478 }
 853168 Jan 20 17:39:49 perf-atlanta sudo[3148364]: 2025-01-20T17:39:49.094Z DEBUG snownet::node: Sampled relay rid=a09e3a22-ad77-4ba7-9c5f-af6be2fbee29 client_id=8b106344-ba59-4050-8f9a-
 853168 e2f0bab6e9e5 cid=8b106344-ba59-4050-8f9a-e2f0bab6e9e5
 853169 Jan 20 17:39:49 perf-atlanta sudo[3148364]: 2025-01-20T17:39:49.094Z  INFO str0m::ice_::agent: Set local credentials: IceCreds { ufrag: "ukaz", pass: "gzl657gypgoavvfm462naq" } cl
 853169 ient_id=8b106344-ba59-4050-8f9a-e2f0bab6e9e5 cid=8b106344-ba59-4050-8f9a-e2f0bab6e9e5
 853170 Jan 20 17:39:49 perf-atlanta sudo[3148364]: 2025-01-20T17:39:49.094Z  INFO str0m::ice_::agent: Set remote credentials: IceCreds { ufrag: "5l4f", pass: "f6cvb6qonhu3z44godgqc4" } c
 853170 lient_id=8b106344-ba59-4050-8f9a-e2f0bab6e9e5 cid=8b106344-ba59-4050-8f9a-e2f0bab6e9e5
 853171 Jan 20 17:39:49 perf-atlanta sudo[3148364]: 2025-01-20T17:39:49.094Z  INFO str0m::ice_::agent: Add local candidate: Candidate(host=155.138.222.187:33808/udp prio=2130706175) clien
 853171 t_id=8b106344-ba59-4050-8f9a-e2f0bab6e9e5 cid=8b106344-ba59-4050-8f9a-e2f0bab6e9e5
 853172 Jan 20 17:39:49 perf-atlanta sudo[3148364]: 2025-01-20T17:39:49.094Z  INFO str0m::ice_::agent: Add local candidate: Candidate(host=[2001:19f0:5401:14df::]:34150/udp prio=213070643
 853172 1) client_id=8b106344-ba59-4050-8f9a-e2f0bab6e9e5 cid=8b106344-ba59-4050-8f9a-e2f0bab6e9e5
 853173 Jan 20 17:39:49 perf-atlanta sudo[3148364]: 2025-01-20T17:39:49.094Z  INFO str0m::ice_::agent: State change (new connection): New -> Checking client_id=8b106344-ba59-4050-8f9a-e2f
 853173 0bab6e9e5 cid=8b106344-ba59-4050-8f9a-e2f0bab6e9e5
 853174 Jan 20 17:39:49 perf-atlanta sudo[3148364]: 2025-01-20T17:39:49.095Z  INFO snownet::node: Replaced existing connection client_id=8b106344-ba59-4050-8f9a-e2f0bab6e9e5 cid=8b106344-
 853174 ba59-4050-8f9a-e2f0bab6e9e5
 853175 Jan 20 17:39:49 perf-atlanta sudo[3148364]: 2025-01-20T17:39:49.096Z  INFO firezone_tunnel::peer: Allowing access to resource client=8b106344-ba59-4050-8f9a-e2f0bab6e9e5 resource=
 853175 33ee0660-431c-4c25-a7b4-4e06d8e3cfba expires=Some("2025-01-27T17:39:15+00:00") client_id=8b106344-ba59-4050-8f9a-e2f0bab6e9e5
 853176 Jan 20 17:39:49 perf-atlanta sudo[3148364]: 2025-01-20T17:39:49.194Z  INFO str0m::ice_::agent: Add remote candidate: Candidate(relay=34.94.86.207:53425/udp prio=50331391) cid=8b10
 853176 6344-ba59-4050-8f9a-e2f0bab6e9e5
 853177 Jan 20 17:39:49 perf-atlanta sudo[3148364]: 2025-01-20T17:39:49.194Z DEBUG str0m::ice_::agent: Add new pair CandidatePair(0-0 prio=216171682568601086 state=Waiting attempts=0 unan
 853177 swered=0 remote=0 last=None nom=None) cid=8b106344-ba59-4050-8f9a-e2f0bab6e9e5
 853178 Jan 20 17:39:49 perf-atlanta sudo[3148364]: 2025-01-20T17:39:49.194Z DEBUG snownet::allocation: No allocation yet, buffering channel binding cid=8b106344-ba59-4050-8f9a-e2f0bab6e9
 853178 e5 peer=34.94.86.207:53425 active_socket=None
 853179 Jan 20 17:39:49 perf-atlanta sudo[3148364]: 2025-01-20T17:39:49.195Z DEBUG snownet::allocation: Request timed out after 1s, re-sending id=TransactionId(0x2A844FFEDE7BFB34E98B4B09)
 853179  method=binding dst=34.162.189.69:3478 active_socket=None
 853180 Jan 20 17:39:49 perf-atlanta sudo[3148364]: 2025-01-20T17:39:49.195Z DEBUG snownet::allocation: Unable to queue binding because we've exceeded its backoffs active_socket=None
 853181 Jan 20 17:39:49 perf-atlanta sudo[3148364]: 2025-01-20T17:39:49.195Z DEBUG snownet::allocation: Request timed out after 1s, re-sending id=TransactionId(0x4899677B9CE2EFE60D192A19)
 853181  method=binding dst=[2600:1901:8130:314:0:15::]:3478 active_socket=None
 853182 Jan 20 17:39:49 perf-atlanta sudo[3148364]: 2025-01-20T17:39:49.195Z DEBUG snownet::allocation: Unable to queue binding because we've exceeded its backoffs active_socket=None
 853183 Jan 20 17:39:49 perf-atlanta sudo[3148364]: 2025-01-20T17:39:49.195Z DEBUG snownet::allocation: Request timed out after 1s, re-sending id=TransactionId(0x1C50E1B65A855AE6BABE2D32)
 853183  method=binding dst=34.145.184.158:3478 active_socket=None
 853184 Jan 20 17:39:49 perf-atlanta sudo[3148364]: 2025-01-20T17:39:49.195Z DEBUG snownet::allocation: Unable to queue binding because we've exceeded its backoffs active_socket=None
 853185 Jan 20 17:39:49 perf-atlanta sudo[3148364]: 2025-01-20T17:39:49.195Z DEBUG snownet::allocation: Request timed out after 1s, re-sending id=TransactionId(0x5D2F1CA31737D0C8F6807F71)
 853185  method=binding dst=[2600:1900:4090:152:0:15::]:3478 active_socket=None
 853186 Jan 20 17:39:49 perf-atlanta sudo[3148364]: 2025-01-20T17:39:49.195Z DEBUG snownet::allocation: Unable to queue binding because we've exceeded its backoffs active_socket=None
 853187 Jan 20 17:39:49 perf-atlanta sudo[3148364]: 2025-01-20T17:39:49.202Z DEBUG reqwest::connect: starting new connection: https://o4507971108339712.ingest.us.sentry.io/
 853188 Jan 20 17:39:49 perf-atlanta sudo[3148364]: 2025-01-20T17:39:49.204Z DEBUG hyper_util::client::legacy::connect::dns: resolving host="o4507971108339712.ingest.us.sentry.io" host=o4
 853188 507971108339712.ingest.us.sentry.io
 853189 Jan 20 17:39:49 perf-atlanta sudo[3148364]: 2025-01-20T17:39:49.205Z  WARN snownet::node: Disconnecting from relay; no response received. Is STUN blocked? rid=a09e3a22-ad77-4ba7-9
 853189 c5f-af6be2fbee29
 853190 Jan 20 17:39:49 perf-atlanta sudo[3148364]: 2025-01-20T17:39:49.207Z  WARN snownet::node: Disconnecting from relay; no response received. Is STUN blocked? rid=dd0a166f-b44b-43e2-b
 853190 af7-974b2880ffb6
```

The above Relay reports a positive Connectivity Test for the Gateway's source IPs, meaning infrastructure is unlikely to be the issue:

<img width="577" alt="Image" src="https://github.com/user-attachments/assets/59c281d1-226d-40be-b538-c7d84c5afc35" />

And therefore we end up in the same state as #7818.

**Comment by thomaseizinger** [comment]
> if a Relay disconnects during ICE (as what likely happened at the start of this issue), perhaps the Gateway enters a state where it no longer is able to communicate with _any_ Relays.

If the relay has positive connectivity then it can't be the one disconnecting. What we see are the symptoms of an unreachable relay when in fact it is reachable. We infer that from missing responses to our requests so one of the following must be happening:

- We never actually send the request on the network.
- Some intermediary drops the request along the way.
- Some intermediary drops the response on the way back.
- We read the response but fail to process it.

Given that the codepaths between the initial allocation (when the gateway first booted) and the new ones are exactly the same, I have no clue as to why repeated ones don't work.

I think last time I checked, these requests never make it to the relay so something is blackholing them before (or we never send them out).

The latter is unlikely because the code paths are exactly the same (unless there is a bug in `quinn-udp` or further down!)

**Comment by thomaseizinger** [comment]
```
2025-01-20T17:39:49.195Z DEBUG snownet::allocation: Request timed out after 1s, re-sending id=TransactionId(0x2A844FFEDE7BFB34E98B4B09) method=binding dst=34.162.189.69:3478 active_socket=None
2025-01-20T17:39:49.195Z DEBUG snownet::allocation: Unable to queue binding because we've exceeded its backoffs active_socket=None
```

This is odd. Why are we giving up after 1s already? I'd expect 4 retries or so.

I need to take a closer look at these logs, are these continuous? Why are the timeouts happening only 3h after the relay was added and not immediately?

**Comment by jamilbk** [comment]
> This is odd. Why are we giving up after 1s already? I'd expect 4 retries or so.

Yeah this is the current state of the Gateway. I thought that was a bit short too?

> I need to take a closer look at these logs, are these continuous? Why are the timeouts happening only 3h after the relay was added and not immediately?

Yeah, they're continuous, taken from the affected Gateway this morning.

I wonder if some race condition during tunnel and firewall setup explains this, or perhaps a bug / API change with netlink or iptables. That would explain why in #7818 we see consistent failures after the first allocation. Perhaps with 1.4.2 on the Vultr VM it's more intermittent.

Back at my desk now, so going to investigate this a bit further.

**Comment by jamilbk** [comment]
> I need to take a closer look at these logs, are these continuous? Why are the timeouts happening only 3h after the relay was added and not immediately?

Sorry, copy-paste error. Here is the continuous capture. Not much better :-(.

```
 853332 Jan 20 17:42:11 perf-atlanta sudo[3148364]: 2025-01-20T17:42:11.091Z DEBUG phoenix_channel: Connecting to portal host=api.firez.one user_agent=Debian/12.0.0 connlib/1.4.2 (x86_64; 6.1.0-22-amd64)
 853333 Jan 20 17:42:11 perf-atlanta sudo[3148364]: 2025-01-20T17:42:11.128Z DEBUG tungstenite::handshake::client: Client handshake done.
 853334 Jan 20 17:42:11 perf-atlanta sudo[3148364]: 2025-01-20T17:42:11.129Z  INFO phoenix_channel: Connected to portal host=api.firez.one
 853335 Jan 20 17:42:11 perf-atlanta sudo[3148364]: 2025-01-20T17:42:11.146Z  INFO snownet::node: Added new TURN server rid=07b4a551-c9a6-486f-a601-6b7309eab3a8 address=Dual { v4: 34.23.55.188:3478, v6: [2600:1900:4021:6e9:0:15::]:3478 }
 853336 Jan 20 17:42:11 perf-atlanta sudo[3148364]: 2025-01-20T17:42:11.146Z  INFO snownet::node: Added new TURN server rid=a09e3a22-ad77-4ba7-9c5f-af6be2fbee29 address=Dual { v4: 34.162.189.69:3478, v6: [2600:1901:8130:314:0:15::]:3478 }
 853337 Jan 20 17:42:11 perf-atlanta sudo[3148364]: 2025-01-20T17:42:11.148Z DEBUG firezone_bin_shared::tun_device_manager::linux: Successfully created ip rule for ipv4
 853338 Jan 20 17:42:11 perf-atlanta sudo[3148364]: 2025-01-20T17:42:11.148Z DEBUG firezone_bin_shared::tun_device_manager::linux: Successfully created ip rule for ipv6
 853339 Jan 20 17:42:11 perf-atlanta sudo[3148364]: 2025-01-20T17:42:11.148Z  INFO firezone_bin_shared::tun_device_manager::linux: Setting new routes new_routes={V6(Ipv6Network { network_address: fd00:2021:1111::, netmask: 107 }), V4(Ipv4Network { network_address: 100.64.0.0, netmask: 11 })}
 853340 Jan 20 17:42:11 perf-atlanta sudo[3148364]: 2025-01-20T17:42:11.149Z DEBUG firezone_bin_shared::tun_device_manager::linux: Created new route route=100.64.0.0/11 iface_idx=39
 853341 Jan 20 17:42:14 perf-atlanta sudo[3148364]: 2025-01-20T17:42:14.123Z DEBUG snownet::node: Sampled relay rid=a09e3a22-ad77-4ba7-9c5f-af6be2fbee29 client_id=8b106344-ba59-4050-8f9a-e2f0bab6e9e5 cid=8b106344-ba59-4050-8f9a-e2f0bab6e9e5
 853342 Jan 20 17:42:14 perf-atlanta sudo[3148364]: 2025-01-20T17:42:14.124Z  INFO str0m::ice_::agent: Set local credentials: IceCreds { ufrag: "ukaz", pass: "gzl657gypgoavvfm462naq" } client_id=8b106344-ba59-4050-8f9a-e2f0bab6e9e5 cid=8b106344-ba59-4050-8f9a-e2f0bab6e9e5
 853343 Jan 20 17:42:14 perf-atlanta sudo[3148364]: 2025-01-20T17:42:14.124Z  INFO str0m::ice_::agent: Set remote credentials: IceCreds { ufrag: "5l4f", pass: "f6cvb6qonhu3z44godgqc4" } client_id=8b106344-ba59-4050-8f9a-e2f0bab6e9e5 cid=8b106344-ba59-4050-8f9a-e2f0bab6e9e5
 853344 Jan 20 17:42:14 perf-atlanta sudo[3148364]: 2025-01-20T17:42:14.124Z  INFO str0m::ice_::agent: Add local candidate: Candidate(host=155.138.222.187:33808/udp prio=2130706175) client_id=8b106344-ba59-4050-8f9a-e2f0bab6e9e5 cid=8b106344-ba59-4050-8f9a-e2f0bab6e9e5
 853345 Jan 20 17:42:14 perf-atlanta sudo[3148364]: 2025-01-20T17:42:14.125Z  INFO str0m::ice_::agent: Add local candidate: Candidate(host=[2001:19f0:5401:14df::]:34150/udp prio=2130706431) client_id=8b106344-ba59-4050-8f9a-e2f0bab6e9e5 cid=8b106344-ba59-4050-8f9a-e2f0bab6e9e5
 853346 Jan 20 17:42:14 perf-atlanta sudo[3148364]: 2025-01-20T17:42:14.125Z  INFO str0m::ice_::agent: State change (new connection): New -> Checking client_id=8b106344-ba59-4050-8f9a-e2f0bab6e9e5 cid=8b106344-ba59-4050-8f9a-e2f0bab6e9e5
 853347 Jan 20 17:42:14 perf-atlanta sudo[3148364]: 2025-01-20T17:42:14.125Z  INFO snownet::node: Created new connection client_id=8b106344-ba59-4050-8f9a-e2f0bab6e9e5 cid=8b106344-ba59-4050-8f9a-e2f0bab6e9e5
 853348 Jan 20 17:42:14 perf-atlanta sudo[3148364]: 2025-01-20T17:42:14.125Z  INFO firezone_tunnel::peer: Allowing access to resource client=8b106344-ba59-4050-8f9a-e2f0bab6e9e5 resource=33ee0660-431c-4c25-a7b4-4e06d8e3cfba expires=Some("2025-01-27T17:39:15+00:00") client_id=8b106344-ba59-4050-8f9a-e2f0bab6e9e5
 853349 Jan 20 17:42:14 perf-atlanta sudo[3148364]: 2025-01-20T17:42:14.220Z  INFO str0m::ice_::agent: Add remote candidate: Candidate(relay=34.16.253.208:55601/udp prio=50331391) cid=8b106344-ba59-4050-8f9a-e2f0bab6e9e5
 853350 Jan 20 17:42:14 perf-atlanta sudo[3148364]: 2025-01-20T17:42:14.221Z DEBUG str0m::ice_::agent: Add new pair CandidatePair(0-0 prio=216171682568601086 state=Waiting attempts=0 unanswered=0 remote=0 last=None nom=None) cid=8b106344-ba59-4050-8f9a-e2f0bab6e9e5
 853351 Jan 20 17:42:14 perf-atlanta sudo[3148364]: 2025-01-20T17:42:14.221Z DEBUG snownet::allocation: No allocation yet, buffering channel binding cid=8b106344-ba59-4050-8f9a-e2f0bab6e9e5 peer=34.16.253.208:55601 active_socket=None
 853352 Jan 20 17:42:14 perf-atlanta sudo[3148364]: 2025-01-20T17:42:14.221Z DEBUG snownet::allocation: Request timed out after 1s, re-sending id=TransactionId(0x0DCA752AA3B413723CEB8FDB) method=binding dst=34.23.55.188:3478 active_socket=None
 853353 Jan 20 17:42:14 perf-atlanta sudo[3148364]: 2025-01-20T17:42:14.221Z DEBUG snownet::allocation: Request timed out after 1s, re-sending id=TransactionId(0x17ABAA02569E555E22C8E1EF) method=binding dst=[2600:1900:4021:6e9:0:15::]:3478 active_socket=None
 853354 Jan 20 17:42:14 perf-atlanta sudo[3148364]: 2025-01-20T17:42:14.221Z DEBUG snownet::allocation: Request timed out after 1s, re-sending id=TransactionId(0x08591AAA1126DFF3955E9282) method=binding dst=[2600:1901:8130:314:0:15::]:3478 active_socket=None
 853355 Jan 20 17:42:14 perf-atlanta sudo[3148364]: 2025-01-20T17:42:14.221Z DEBUG snownet::allocation: Request timed out after 1s, re-sending id=TransactionId(0xA9B522F7C108AEEF239147E3) method=binding dst=34.162.189.69:3478 active_socket=None
 853356 Jan 20 17:42:14 perf-atlanta sudo[3148364]: 2025-01-20T17:42:14.221Z  INFO str0m::ice_::agent: Add remote candidate: Candidate(srflx=107.197.104.68:54486/udp prio=1694498559) cid=8b106344-ba59-4050-8f9a-e2f0bab6e9e5
 853357 Jan 20 17:42:14 perf-atlanta sudo[3148364]: 2025-01-20T17:42:14.222Z DEBUG str0m::ice_::agent: Add new pair CandidatePair(0-1 prio=7277815898285538814 state=Waiting attempts=0 unanswered=0 remote=0 last=None nom=None) cid=8b106344-ba59-4050-8f9a-e2f0bab6e9e5
 853358 Jan 20 17:42:14 perf-atlanta sudo[3148364]: 2025-01-20T17:42:14.222Z DEBUG snownet::allocation: No allocation yet, buffering channel binding cid=8b106344-ba59-4050-8f9a-e2f0bab6e9e5 peer=107.197.104.68:54486 active_socket=None
 853359 Jan 20 17:42:14 perf-atlanta sudo[3148364]: 2025-01-20T17:42:14.222Z  INFO str0m::ice_::agent: Add remote candidate: Candidate(host=192.168.1.150:54486/udp prio=2130706175) cid=8b106344-ba59-4050-8f9a-e2f0bab6e9e5
 853360 Jan 20 17:42:14 perf-atlanta sudo[3148364]: 2025-01-20T17:42:14.222Z DEBUG str0m::ice_::agent: Add new pair CandidatePair(0-2 prio=9151313343271665150 state=Waiting attempts=0 unanswered=0 remote=0 last=None nom=None) cid=8b106344-ba59-4050-8f9a-e2f0bab6e9e5
 853361 Jan 20 17:42:14 perf-atlanta sudo[3148364]: 2025-01-20T17:42:14.222Z  INFO str0m::ice_::agent: Add remote candidate: Candidate(relay=[2600:1900:4180:699:0:15::]:55601/udp prio=50331647) cid=8b106344-ba59-4050-8f9a-e2f0bab6e9e5
 853362 Jan 20 17:42:14 perf-atlanta sudo[3148364]: 2025-01-20T17:42:14.222Z DEBUG str0m::ice_::agent: Add new pair CandidatePair(1-3 prio=216172782080229374 state=Waiting attempts=0 unanswered=0 remote=0 last=None nom=None) cid=8b106344-ba59-4050-8f9a-e2f0bab6e9e5
 853363 Jan 20 17:42:14 perf-atlanta sudo[3148364]: 2025-01-20T17:42:14.222Z DEBUG snownet::allocation: No allocation yet, buffering channel binding cid=8b106344-ba59-4050-8f9a-e2f0bab6e9e5 peer=[2600:1900:4180:699:0:15::]:55601 active_socket=None
 853364 Jan 20 17:42:14 perf-atlanta sudo[3148364]: 2025-01-20T17:42:14.222Z  INFO str0m::ice_::agent: Add remote candidate: Candidate(srflx=[2600:1700:3ecb:2410:65b3:5c14:3bfd:e784]:56263/udp prio=1694498815) cid=8b106344-ba59-4050-8f9a-e2f0bab6e9e5
 853365 Jan 20 17:42:14 perf-atlanta sudo[3148364]: 2025-01-20T17:42:14.222Z DEBUG str0m::ice_::agent: Add new pair CandidatePair(1-4 prio=7277816997797167102 state=Waiting attempts=0 unanswered=0 remote=0 last=None nom=None) cid=8b106344-ba59-4050-8f9a-e2f0bab6e9e5
 853366 Jan 20 17:42:14 perf-atlanta sudo[3148364]: 2025-01-20T17:42:14.222Z DEBUG snownet::allocation: No allocation yet, buffering channel binding cid=8b106344-ba59-4050-8f9a-e2f0bab6e9e5 peer=[2600:1700:3ecb:2410:65b3:5c14:3bfd:e784]:56263 active_socket=None
 853367 Jan 20 17:42:14 perf-atlanta sudo[3148364]: 2025-01-20T17:42:14.222Z  INFO str0m::ice_::agent: Add remote candidate: Candidate(host=[2600:1700:3ecb:2410:65b3:5c14:3bfd:e784]:56263/udp prio=2130706431) cid=8b106344-ba59-4050-8f9a-e2f0bab6e9e5
 853368 Jan 20 17:42:14 perf-atlanta sudo[3148364]: 2025-01-20T17:42:14.222Z DEBUG str0m::ice_::agent: Replace redundant pair, current: CandidatePair(1-4 prio=7277816997797167102 state=InProgress attempts=1 unanswered=1 remote=0 last=None nom=None) replaced with: CandidatePair(1-5 prio=9151314442783293438 state=Waiting attempts=0 unanswered=0 remote=0 last=None nom=None) c
 853368 id=8b106344-ba59-4050-8f9a-e2f0bab6e9e5
 853369 Jan 20 17:42:23 perf-atlanta sudo[3148364]: 2025-01-20T17:42:23.634Z DEBUG snownet::node: Already got a connection client_id=8b106344-ba59-4050-8f9a-e2f0bab6e9e5 cid=8b106344-ba59-4050-8f9a-e2f0bab6e9e5
 853370 Jan 20 17:42:23 perf-atlanta sudo[3148364]: 2025-01-20T17:42:23.635Z  INFO firezone_tunnel::peer: Allowing access to resource client=8b106344-ba59-4050-8f9a-e2f0bab6e9e5 resource=33ee0660-431c-4c25-a7b4-4e06d8e3cfba expires=Some("2025-01-27T17:39:15+00:00") client_id=8b106344-ba59-4050-8f9a-e2f0bab6e9e5
 853371 Jan 20 17:42:23 perf-atlanta sudo[3148364]: 2025-01-20T17:42:23.731Z  INFO str0m::ice_::agent: Add remote candidate: Candidate(relay=34.94.86.207:53425/udp prio=50331391) cid=8b106344-ba59-4050-8f9a-e2f0bab6e9e5
 853372 Jan 20 17:42:23 perf-atlanta sudo[3148364]: 2025-01-20T17:42:23.731Z DEBUG str0m::ice_::agent: Add new pair CandidatePair(0-6 prio=216171682568601086 state=Waiting attempts=0 unanswered=0 remote=0 last=None nom=None) cid=8b106344-ba59-4050-8f9a-e2f0bab6e9e5
 853373 Jan 20 17:42:23 perf-atlanta sudo[3148364]: 2025-01-20T17:42:23.731Z DEBUG snownet::allocation: No allocation yet, buffering channel binding cid=8b106344-ba59-4050-8f9a-e2f0bab6e9e5 peer=34.94.86.207:53425 active_socket=None
 853374 Jan 20 17:42:23 perf-atlanta sudo[3148364]: 2025-01-20T17:42:23.731Z DEBUG snownet::allocation: Request timed out after 1.5s, re-sending id=TransactionId(0x0DCA752AA3B413723CEB8FDB) method=binding dst=34.23.55.188:3478 active_socket=None
 853375 Jan 20 17:42:23 perf-atlanta sudo[3148364]: 2025-01-20T17:42:23.732Z DEBUG snownet::allocation: Unable to queue binding because we've exceeded its backoffs active_socket=None
 853376 Jan 20 17:42:23 perf-atlanta sudo[3148364]: 2025-01-20T17:42:23.732Z DEBUG snownet::allocation: Request timed out after 1.5s, re-sending id=TransactionId(0x17ABAA02569E555E22C8E1EF) method=binding dst=[2600:1900:4021:6e9:0:15::]:3478 active_socket=None
 853377 Jan 20 17:42:23 perf-atlanta sudo[3148364]: 2025-01-20T17:42:23.732Z DEBUG snownet::allocation: Unable to queue binding because we've exceeded its backoffs active_socket=None
 853378 Jan 20 17:42:23 perf-atlanta sudo[3148364]: 2025-01-20T17:42:23.732Z DEBUG snownet::allocation: Request timed out after 1.5s, re-sending id=TransactionId(0x08591AAA1126DFF3955E9282) method=binding dst=[2600:1901:8130:314:0:15::]:3478 active_socket=None
 853379 Jan 20 17:42:23 perf-atlanta sudo[3148364]: 2025-01-20T17:42:23.732Z DEBUG snownet::allocation: Unable to queue binding because we've exceeded its backoffs active_socket=None
 853380 Jan 20 17:42:23 perf-atlanta sudo[3148364]: 2025-01-20T17:42:23.732Z DEBUG snownet::allocation: Request timed out after 1.5s, re-sending id=TransactionId(0xA9B522F7C108AEEF239147E3) method=binding dst=34.162.189.69:3478 active_socket=None
 853381 Jan 20 17:42:23 perf-atlanta sudo[3148364]: 2025-01-20T17:42:23.732Z DEBUG snownet::allocation: Unable to queue binding because we've exceeded its backoffs active_socket=None
 853382 Jan 20 17:42:23 perf-atlanta sudo[3148364]: 2025-01-20T17:42:23.737Z DEBUG reqwest::connect: starting new connection: https://o4507971108339712.ingest.us.sentry.io/
 853383 Jan 20 17:42:23 perf-atlanta sudo[3148364]: 2025-01-20T17:42:23.738Z  WARN snownet::node: Disconnecting from relay; no response received. Is STUN blocked? rid=07b4a551-c9a6-486f-a601-6b7309eab3a8
 853384 Jan 20 17:42:23 perf-atlanta sudo[3148364]: 2025-01-20T17:42:23.739Z  WARN snownet::node: Disconnecting from relay; no response received. Is STUN blocked? rid=a09e3a22-ad77-4ba7-9c5f-af6be2fbee29
```

**Comment by thomaseizinger** [comment]
I just captured a tcpdump on the offending Gateway:

```
02:24:31.979485 IP 155.138.222.187.33808 > 34.23.55.188.3478: UDP, length 108
02:24:31.979561 IP 155.138.222.187.33808 > 34.162.189.69.3478: UDP, length 108
02:24:31.979717 IP6 2001:19f0:5401:14df::.34150 > 2600:1900:4021:6e9:0:15::.3478: UDP, length 108
02:24:31.979782 IP6 2001:19f0:5401:14df::.34150 > 2600:1901:8130:314:0:15::.3478: UDP, length 108
02:24:31.991324 IP6 2600:1900:4021:6e9:0:15::.3478 > 2001:19f0:5401:14df::.34150: UDP, length 44
02:24:31.992410 IP 34.23.55.188.3478 > 155.138.222.187.33808: UDP, length 32
02:24:31.998442 IP6 2600:1901:8130:314:0:15::.3478 > 2001:19f0:5401:14df::.34150: UDP, length 44
02:24:31.998443 IP 34.162.189.69.3478 > 155.138.222.187.33808: UDP, length 32
02:24:34.268959 IP 155.138.222.187.33808 > 34.23.55.188.3478: UDP, length 108
02:24:34.269004 IP 155.138.222.187.33808 > 34.162.189.69.3478: UDP, length 108
02:24:34.269131 IP6 2001:19f0:5401:14df::.34150 > 2600:1900:4021:6e9:0:15::.3478: UDP, length 108
02:24:34.269168 IP6 2001:19f0:5401:14df::.34150 > 2600:1901:8130:314:0:15::.3478: UDP, length 108
02:24:34.269225 IP 155.138.222.187.33808 > 34.150.37.141.58598: UDP, length 88
02:24:34.269258 IP 155.138.222.187.33808 > 60.251.48.108.53011: UDP, length 88
02:24:34.269306 IP 155.138.222.187.33808 > 192.168.0.204.53011: UDP, length 88
02:24:34.269360 IP6 2001:19f0:5401:14df::.34150 > 2600:1900:41a1:57b:0:15::.58598: UDP, length 88
02:24:34.280087 IP 34.23.55.188.3478 > 155.138.222.187.33808: UDP, length 32
```

We definitely send AND receive traffic from the relay (see everything with 3478). The question now is, why aren't those packets being processed by `connlib`?

**Comment by thomaseizinger** [comment]
I think we need to up the log level, restart it and hope that it reproduces.

**Comment by thomaseizinger** [comment]
> I think we need to up the log level, restart it and hope that it reproduces.

The perf gateway in Sydney is now running with increased log level. Let's see if it reproduces.

**Comment by jamilbk** [comment]
I think I found the bug. If all Relays disconnect for an extended period of time, we go into a chicked-and-egg failed state where we won't create a new allocation upon portal reconnection:


```
 766328 Jan 28 07:11:19 perf-atlanta sudo[3148364]: 2025-01-28T07:11:19.600Z  INFO phoenix_channel: Connected to portal host=api.firez.one
 766329 Jan 28 07:11:19 perf-atlanta sudo[3148364]: 2025-01-28T07:11:19.618Z  INFO snownet::node: Added new TURN server rid=0f74d155-eb12-4380-aef4-ca02b0acb7a4 address=Dual { v4: 34.23.24.192:3478, v6: [2600:1900:4020:689:0:e::]:3478 }
 766330 Jan 28 07:11:19 perf-atlanta sudo[3148364]: 2025-01-28T07:11:19.618Z  INFO snownet::node: Added new TURN server rid=94c28126-b4f0-43c5-bf59-7dd1b80a1c4f address=Dual { v4: 34.162.10.93:3478, v6: [2600:1901:8130:2e:0:e::]:3478 }
 766331 Jan 28 07:11:19 perf-atlanta sudo[3148364]: 2025-01-28T07:11:19.618Z DEBUG snownet::allocation: Refreshing allocation active_socket=None
 766332 Jan 28 07:11:19 perf-atlanta sudo[3148364]: 2025-01-28T07:11:19.618Z DEBUG snownet::allocation: Unable to queue refresh because we haven't nominated a socket yet active_socket=None
 766333 Jan 28 07:11:19 perf-atlanta sudo[3148364]: 2025-01-28T07:11:19.619Z DEBUG snownet::allocation: Refreshing allocation active_socket=None
 766334 Jan 28 07:11:19 perf-atlanta sudo[3148364]: 2025-01-28T07:11:19.619Z DEBUG snownet::allocation: Unable to queue refresh because we haven't nominated a socket yet active_socket=None
```

In the above logs, you can see that we receive two new TURN servers but proceed to treat them as "refreshes" and then refuse to continue making an allocation.

~1 minute 26 seconds go by and then the portal sends us a couple more `relays_presence` message which we see:


```
 766339 Jan 28 07:20:45 perf-atlanta sudo[3148364]: 2025-01-28T07:20:45.564Z  INFO snownet::node: Removed TURN server rid=94c28126-b4f0-43c5-bf59-7dd1b80a1c4f address=Dual { v4: 34.162.10.93:3478, v6: [2600:1901:8130:2e:0:e::]:3478 }
 766340 Jan 28 07:20:45 perf-atlanta sudo[3148364]: 2025-01-28T07:20:45.565Z  INFO snownet::node: Replaced TURN server rid=0f74d155-eb12-4380-aef4-ca02b0acb7a4 address=Dual { v4: 34.23.24.192:3478, v6: [2600:1900:4020:689:0:e::]:3478 }
 766341 Jan 28 07:20:45 perf-atlanta sudo[3148364]: 2025-01-28T07:20:45.565Z  INFO snownet::node: Replaced TURN server rid=e6a3d738-1475-4f17-a637-1494ce7871a1 address=Dual { v4: 34.21.64.144:3478, v6: [2600:1900:4090:91:0:e::]:3478 }
 766342 Jan 28 07:20:45 perf-atlanta sudo[3148364]: 2025-01-28T07:20:45.565Z DEBUG snownet::allocation: Refreshing allocation active_socket=None
 766343 Jan 28 07:20:45 perf-atlanta sudo[3148364]: 2025-01-28T07:20:45.565Z DEBUG snownet::allocation: Unable to queue refresh because we haven't nominated a socket yet active_socket=None
```

But then we immediate fail to create an allocation, with the logs remaining silent at that point going forward.

**Comment by jamilbk** [comment]
Is there a hard coded limit to how many allocations connlib will try to maintain before giving up? Perhaps the increased number of Relays is causing more noisy `relays_presence` messages and connlib runs out of state buffers to track them.

If we make sure to always to create new allocations when the portal tells us about new TURN servers I think that will fix the bug.

In addition to that, perhaps we should retry creating allocations for the last 2 TURN servers the portal has told us about, whenever a client connects. If we've stopped trying to create allocations because of an extended network partition with the Relays (but not the portal), that ensure that when a client tries to connect it will self-heal.

I could have sworn we have some of this logic in there already, but maybe a state or timer bug is preventing it from kicking in. This log section would be our big clue there's a state/timer bug I suppose:

```
 766371 Jan 28 16:50:45 perf-atlanta sudo[3148364]: 2025-01-28T16:50:45.715Z DEBUG snownet::allocation: No allocation yet, buffering channel binding cid=8b106344-ba59-4050-8f9a-e2f0bab6e9e5 peer=34.125.10.0:58491 active_socket=None
 766372 Jan 28 16:50:45 perf-atlanta sudo[3148364]: 2025-01-28T16:50:45.716Z DEBUG snownet::allocation: Request timed out after 1s, re-sending id=TransactionId(0x167CF7A8F3D5E987DB1E2382) method=binding dst=[2600:1900:4020:689:0:e::]:3478 active_socket=None
 766373 Jan 28 16:50:45 perf-atlanta sudo[3148364]: 2025-01-28T16:50:45.716Z DEBUG snownet::allocation: Unable to queue binding because we've exceeded its backoffs active_socket=None
 766374 Jan 28 16:50:45 perf-atlanta sudo[3148364]: 2025-01-28T16:50:45.716Z DEBUG snownet::allocation: Request timed out after 1s, re-sending id=TransactionId(0xAB5C0C4E643865FC4CB29EBA) method=binding dst=34.23.24.192:3478 active_socket=None
 766375 Jan 28 16:50:45 perf-atlanta sudo[3148364]: 2025-01-28T16:50:45.716Z DEBUG snownet::allocation: Unable to queue binding because we've exceeded its backoffs active_socket=None
 766376 Jan 28 16:50:45 perf-atlanta sudo[3148364]: 2025-01-28T16:50:45.716Z DEBUG snownet::allocation: Request timed out after 1s, re-sending id=TransactionId(0xCF62361CAC69ECAFAF575EA1) method=binding dst=[2600:1901:8140:2f1:0:d::]:3478 active_socket=None
 766377 Jan 28 16:50:45 perf-atlanta sudo[3148364]: 2025-01-28T16:50:45.716Z DEBUG snownet::allocation: Unable to queue binding because we've exceeded its backoffs active_socket=None
 766378 Jan 28 16:50:45 perf-atlanta sudo[3148364]: 2025-01-28T16:50:45.716Z DEBUG snownet::allocation: Request timed out after 1s, re-sending id=TransactionId(0xD6E867EF003DA23F7FD8DFC1) method=binding dst=34.174.213.189:3478 active_socket=None
 766379 Jan 28 16:50:45 perf-atlanta sudo[3148364]: 2025-01-28T16:50:45.716Z DEBUG snownet::allocation: Unable to queue binding because we've exceeded its backoffs active_socket=None
 766380 Jan 28 16:50:45 perf-atlanta sudo[3148364]: 2025-01-28T16:50:45.716Z DEBUG snownet::allocation: Request timed out after 1s, re-sending id=TransactionId(0x9F2546201639A603DBE70E77) method=binding dst=[2600:1901:8130:2e:0:e::]:3478 active_socket=None
 766381 Jan 28 16:50:45 perf-atlanta sudo[3148364]: 2025-01-28T16:50:45.717Z DEBUG snownet::allocation: Unable to queue binding because we've exceeded its backoffs active_socket=None
 766382 Jan 28 16:50:45 perf-atlanta sudo[3148364]: 2025-01-28T16:50:45.717Z DEBUG snownet::allocation: Request timed out after 1s, re-sending id=TransactionId(0xEA54BD87B49BADA0BD251C1A) method=binding dst=34.162.10.93:3478 active_socket=None
 766383 Jan 28 16:50:45 perf-atlanta sudo[3148364]: 2025-01-28T16:50:45.717Z DEBUG snownet::allocation: Unable to queue binding because we've exceeded its backoffs active_socket=None
```

In the above log, we see the `.93` and `.192` Relays from the portal reconnect in my previous post, however we also have an imposter: `34.174.213.189`. This Relay was added here, over 13 hours prior:


```
 2025-01-28T07:06:15.060Z  INFO snownet::node: Added new TURN server rid=7f3a1cc7-2424-4862-82af-73f09fed96f9 address=Dual { v4: 34.174.213.189:3478, v6: [2600:1901:8140:2f1:0:d::]:3478 }
```

And no successful allocation was ever made with it. So when we reconnect to the portal in my last post, we get two new TURN servers, and now we have three. And for some reason we keep trying the `.189` Relay even though in all likelihood it's been rolled over.

**Comment by jamilbk** [comment]
So I think the thing I'm seeing a pattern of in the logs which doesn't make sense is:


1. We deploy staging
2. Portal deploys -> we reconnect and get two new TURN servers
3. We're now tracking 3 relays, even though the extra one we don't (or have never had) an allocation with.
4. Portal might send us a relays_presence, but since our current portal connection has never seen the imposter relay, it doesn't tell us to disconnect from it.
5. When a client connects, we buffer the channel binding and try to allocate with all (3) Relays again
6. We fail immediately (after 1s) presumably because we're tracking a Relay that has failed before, and so we don't keep retrying the other two, or worse, we fail all three if a single one fails (??) <- this seems to be the bug preventing self-healing.

Keep in mind when the portal reconnects, all bets are off as to receiving a `relays_presence` - we will only get that for the Relays the portal has sent us within the current connection.

So it probably makes sense to discard any relays on portal reconnect that we don't have an active channel binding with?

**Comment by jamilbk** [comment]
Full log capture I used in the above analysis:

[gateway.log.zip](https://github.com/user-attachments/files/18578040/gateway.log.zip)

**Comment by thomaseizinger** [comment]
> In the above logs, you can see that we receive two new TURN servers but proceed to treat them as "refreshes" and then refuse to continue making an allocation.

Nah I think you are misreading the concurrency here. The "refreshing" is related to _other_ TURN servers we still have locally. We only do that for the allocations that we _didn't_ add:

https://github.com/firezone/firezone/blob/9711cf56c1879f7a139a5849cb3d1c8d1ce9f9c2/rust/connlib/snownet/src/node.rs#L682-L694

I think the underlying problem here is some kind of bug that prevents us from sending particular messages at the correct time. Every time you see `Added new TURN server` or `Replaced TURN server`, we _should_ see outgoing STUN messages on the wire. Unfortunately, the log level doesn't show that but we should be able to capture that with `tcpdump`.

**Comment by thomaseizinger** [comment]
With the newly added keepalive in #7819, we could ditch the `relays_presence` message to some degree as we can now detect ourselves within ~35s that a certain relay is no longer there.

**Comment by jamilbk** [comment]
> we can now detect ourselves within ~35s that a certain relay is no longer there.

Hm yeah. I guess the question is though is it still valuable for the portal to tell us about disconnected relays? Otherwise we wouldn't be able to tell the difference between STUN being blocked locally (which we've seen in support issues) and a Relay that's just gone.

If we treat the portal's Relay messages as the "source of truth", we can at least keep trying the ones it gives us indefinitely, so that we self-heal if the user fixes whatever connectivity issue preventing connlib from reaching them.

**Comment by thomaseizinger** [comment]
I used `perf` to take a performance profile while triggering the `relays_presence` with a frequence of 100000hz. That pretty much visualises every function call during that time because the binary is doing so little. Here is what I found about `Io::poll`:
We only get to `Tun::poll_send_ready` and we don't see any record of it polling the UDP sockets. If we look at the code in `io.rs` we can see that as the very first thing, we call `flush_send_queue`. Within that function, we also check if we can send packets to the TUN device. If the TUN device isn't ready then we bail out of that function and never read from the UDP sockets. This is on purpose! We don't want to read more UDP packets when we are falling behind in writing the TUN packets in order to maintain backpressure!

So my first thought was: The TUN threads must have exited but checking with top those are still there but for some reason, they aren't doing anything ...
I think this might be related to the bug https://github.com/firezone/firezone/pull/7605 where we identified that we are associating the async FD of the TUN device with the wrong runtime.
Anyway, I am pretty certain that the reason for the behaviour we are seeing is that for some reason, the TUN device is not ready for writing and therefore, we bail out of `Io::poll` before we can read the response from the relays.

I don't think there is much we can do here. We now merged #7944 and perhaps #7605 already fixed this. I am going to close this. We'll see if it comes up again!

**Comment by jamilbk** [comment]
Customer may have hit this issue too. Linking here for posterity.

https://firezonehq.slack.com/archives/C06L41XN05T/p1739267494554949
